,0,1
912,государственный сектор австралия стратегия безопасность дорога стратегия,126
913,безопасность дорога стратегия борьба,126
914,с наркотик стратегия финансовый грамотность,126
915,наркотик стратегия финансовый грамотность лесной стратегия стратегия,126
916,лесной стратегия стратегия развитие информационно-коммуникационный технология,126
917,в публичный сфера инфраструктурный стратегия,126
918,публичный сфера инфраструктурный стратегия великобритания индустриальный стратегия стратегия,126
919,великобритания индустриальный стратегия стратегия регенерация здание стратегия,126
920,регенерация здание стратегия большой бизнес дорожный,126
921,большой бизнес дорожный стратегия углеводородный стратегия алкогольный,126
922,стратегия углеводородный стратегия алкогольный стратегия стратегия контроль,126
923,стратегия стратегия контроль заболевание,126
924,стратегия защита от наводнение,126
925,защита от наводнение и,126
926,и береговой эрозия местный,126
927,береговой эрозия местный стратегия германия,126
928,стратегия германия стратегия устойчивый развитие,126
929,стратегия устойчивый развитие канада стратегия устойчивый развитие,126
930,канада стратегия устойчивый развитие стратегия,126
931,стратегия уменьшение выброс парниковый,126
932,уменьшение выброс парниковый газ северный стратегия атлантический,126
933,газ северный стратегия атлантический стратегия миграционный стратегия судостроительный,126
934,стратегия миграционный стратегия судостроительный стратегия стратегия преодоление гендерный,126
935,стратегия стратегия преодоление гендерный насилие стратегия поддержка бездомный,126
936,насилие стратегия поддержка бездомный стратегия,126
937,восстановление популяция северный олень,126
938,популяция северный олень китай пятилетний план,126
939,китай пятилетний план программа устойчивый развитие,126
940,программа устойчивый развитие начало,126
941,начало го век великий,126
942,го век великий шёлковый путь стратегия,126
943,шёлковый путь стратегия инновационный,126
944,развитие стратегия информационный безопасность,126
945,стратегия информационный безопасность малайзия административный реформа стратегический,126
946,малайзия административный реформа стратегический план,126
947,сфера информационный технология сша,126
948,сша стратегия национальный безопасность,126
949,стратегия национальный безопасность цифровой стратегия стратегия,126
950,цифровой стратегия стратегия профилактика стратегия борьба,126
951,профилактика стратегия борьба с,126
952,с спид экологический стратегия,126
953,спид экологический стратегия франция,126
954,франция программа стабильность космический,126
955,программа стабильность космический стратегия стратегия искусственный интеллект,126
956,стратегия стратегия искусственный интеллект стратегия электронный правительство,126
957,стратегия электронный правительство стратегия информационный безопасность,126
958,стратегия информационный безопасность из,126
959,из это короткий обзор,126
960,это короткий обзор видно что,126
961,реализация принцип стратегический управление,126
962,принцип стратегический управление в,126
963,страна осуществляться очень по-разному,126
964,осуществляться очень по-разному в,126
965,россия процесс стратегический планирование,126
966,процесс стратегический планирование регулироваться федеральный закон,126
967,регулироваться федеральный закон о стратегический планирование,126
968,в российский федерация фз принятый,126
969,российский федерация фз принятый июнь год,126
970,воротный вена печёночный вена воротный вена печёночный вена,126
971,выше мм рт ст,125
972,в старший возрастной группа,125
973,для принятие решение о,125
974,артериальный давление ада и,125
975,мочь быть достигнуть при,125
976,система обыкновенный дифференциальный уравнение,125
977,то же время результат,125
978,можно сделать следующий вывод,125
979,и избыточный масса тело,125
980,смешанный фенотип хобласть ба,125
981,как быть сказать выше,124
982,вне зависимость от наличие,124
983,ишемический болезнь сердце в,124
984,мочь играть важный роль в,124
985,до наш э в,124
986,тот ким о ра зом,124
987,у практически здоровый лицо,124
988,оставаться один из самый,124
989,средний возраст год женщина,124
990,вне зависимость от тот,124
991,мг килограмм сут в,124
992,по крайний мера на,123
993,важный фактор риска развитие,123
994,мочь быть определить по,123
995,не вызывать сомнение тот факт что,123
996,индекс масса тело и,123
997,при ревматоидный артрит ра,123
998,один из наиболее актуальный,123
999,доза мг килограмм и,123
1000,в отличие от предыдущий,123
1001,в ткань головной мозг,123
1002,один из основный механизм,123
1003,больной быть разделить на,123
1004,на тысяча население а,123
1005,до середина х год,123
1006,общий периферический сосудистый сопротивление,122
1007,оставаться один из наиболее,122
1008,за последний десятилетие в,122
1009,многочисленный исследование показать что,122
1010,занимать первое место в,122
1011,однако необходимый отметить что,122
1012,который до сей пора,122
1013,на наш взгляд в,122
1014,и социально-образовательный мысль метр,122
1015,с сторона желудочно-кишечный тракт жкт,122
1016,нет единый мнение о,122
1017,ре зуля тот тот,122
1018,эпидемический ситуация по туберкулёз,122
1019,тре о ни на,122
1020,тот или иной тип,121
1021,необходимый обратить внимание на,121
1022,по данные воз в,121
1023,поясничный отдел позвоночник и,121
1024,иметься на сегодняшний день,121
1025,отделение интенсивный терапия в,121
1026,создание благоприятный условие для,121
1027,у больной скв с,121
1028,то же время существовать,121
1029,ме тот бо ли,121
1030,один из основный направление,121
1031,в отдалённый послеоперационный период,121
1032,один из самый эффективный,120
1033,с врождённый порок сердце,120
1034,что на сегодняшний день,120
1035,то же время применение,120
1036,и женщина средний возраст,120
1037,что свидетельствовать о тот,120
1038,мм рт ст для,120
1039,от лента наш метр грраспределенный нагрузка отгруз,120
1040,метр грраспределенный нагрузка отгруз наш,120
1041,наш метр угол наклон,120
1042,литр нед счёт сш,120
1043,нед счёт сш счёт эда соэ мм,120
1044,вопрос современный педиатрия введение,119
1045,такой образ на сегодняшний день,119
1046,год после постановка диагноз,119
1047,и колебаться от до,119
1048,качество оказание медицинский помощь,119
1049,с дада мм рт ст,119
1050,на фон проводить терапия,119
1051,и ишемический болезнь сердце,119
1052,не позволять сделать однозначный вывод,119
1053,метр площадь поперечный сечение,119
1054,острый период травматический болезнь,119
1055,в два раз чаща,118
1056,и послужить основание для,118
1057,в настоящий работа представить,118
1058,обусловить тем что в,118
1059,занимать особый место в,118
1060,также мочь быть связать,118
1061,с помощь компьютерный программа,118
1062,статистически значимый различие по,118
1063,в группа без рм,118
1064,том снижение активность промотор,118
1065,снижение активность промотор снижение риска,118
1066,снижение риска плоскоклеточный рак пищевод,118
1067,плоскоклеточный рак пищевод снижение риска,118
1068,снижение риска рак носоглотка промотор аллель,118
1069,в рандомизировать исследование фаза,117
1070,для тот или иной,117
1071,улучшение качество жизнь больной,117
1072,система линейный алгебраический уравнение,117
1073,с использование пакет программа,116
1074,к белок коровий молоко,116
1075,который мочь повлиять на,116
1076,один из наиболее частый причина,116
1077,существенно не отличаться от,116
1078,ар тот ри аль но го дать,116
1079,аль но го дать ле ния,116
1080,главный комплекс гистосовместимость класс,116
1081,высокий риск развитие осложнение,116
1082,клетка рак молочный железа,116
1083,позволять говорить о тот,116
1084,источник составить автор на,116
1085,мм рт ст р,116
1086,по мнение многий исследователь,115
1087,с острый коронарный синдром окс,115
1088,вестник калмыцкий институт гуманитарный исследование,115
1089,и хронический сердечный недостаточность,115
1090,не мочь рассматриваться как,115
1091,приводить к снижение риска,115
1092,ранний послеоперационный период и,115
1093,с хронический сердечный недостаточность хсн,115
1094,в литература описать несколько,115
1095,один из самый важный,115
1096,который свидетельствовать о тот,115
1097,в зал петра великое,115
1098,в страна восточный европа,115
1099,сантиметр вод ст не,115
1100,нед мг килограмм в,115
1101,на следующий элементарный сечение ог,115
1102,занимать промежуточный положение между,114
1103,с иса поль зо ва,114
1104,или транзиторный ишемический атака,114
1105,и сахарный диабет тип,114
1106,через мес после начало,114
1107,рандомизировать двойной слепой плацебоконтролировать исследование,114
1108,иса сле до ва нии,114
1109,в начало хх век,114
1110,и центральный нервный система,114
1111,на момент установление диагноз,114
1112,оказывать непосредственный влияние на,114
1113,уменьшение сопротивление дыхательный путь,114
1114,занимать два место в,113
1115,с сахарный диабет тип,113
1116,рандомизировать двойной слепой плацебо-контролировать исследование,113
1117,национальный институт здоровье сша,113
1118,за последний два десятилетие,113
1119,важный фактор влиять на,113
1120,с сторона центральный нервный,113
1121,в два раз большой,113
1122,мочь приводить к нарушение,113
1123,иса сле до ва ний,113
1124,в раз реж чем,113
1125,на центральный нервный система,113
1126,синдром системный воспалительный реакция,113
1127,как фактор риска развитие,113
1128,тем не менее дать,113
1129,средний доза мг сут,113
1130,в сто ци о,113
1131,нести по соб нос,113
1132,существенно выше чем в,112
1133,однако несмотря на то,112
1134,ре зуля тот ты,112
1135,мочь повлечь за себя,112
1136,и генно-инженерный биологический препарат,112
1137,что мочь указывать на,112
1138,в то же вре мя,112
1139,пациент перенести операция на,112
1140,в течение несколько секунда,112
1141,и играть ключевой роль,112
1142,до парез гортань связать,112
1143,респираторный вариабельность базовый линия,112
1144,ру е май ги бель кле ток,112
1145,бель кле ток по дать ле,112
1146,по дать ле ние расти тот,112
1147,по дать ле ние ап па ра,112
1148,ние ап па ра тот де ле,112
1149,и ка лия па де,112
1150,ка лия па де ние внут рик ле,112
1151,сто ци о нары ной фа зе,112
1152,фора ми ро ва ние фима б рий,112
1153,ный ре гу ля тор фора ми ро,112
1154,с не ус тот,112
1155,в значительный степень обусловить,111
1156,мочь быть рекомендовать для,111
1157,в настоящий работа рассматриваться,111
1158,свой очередь приводить к увеличение,111
1159,оценка по шкала апгар,111
1160,колебаться от до и,111
1161,на самый ранний этап,111
1162,два половина хх в,111
1163,являться основной причина смерть,111
1164,развитие рак молочный железа,111
1165,пациент варьировать от до,111
1166,варьировать от до год,111
1167,результат ранее провести исследование,111
1168,в вид внутривенный инфузия,111
1169,в плата дпереть мство,111
1170,по зависимость ширина лента,111
1171,с сторона усилие приложить,111
1172,сторона усилие приложить к приводной подвеска,111
1173,или после математический преобразование,111
1174,после математический преобразование получать,111
1175,фактор влиять на развитие,110
1176,и ишемический болезнь сердце ибс,110
1177,по критерий манный уитня,110
1178,острый коронарный синдром и,110
1179,по данные разный исследователь,110
1180,настоящее время существовать большой количество,110
1181,длина волна нм и,110
1182,с длина волна мкм,110
1183,фактор некроз опухоль фно и,110
1184,иметь повышенный риск развитие,110
1185,то же время на,110
1186,с использование набор реагент,110
1187,эн до тот ли,110
1188,не дос тот точ ность,110
1189,у лицо пожилое и,110
1190,в европейский рекомендация по,110
1191,частота развитие острый почечный,110
1192,до сантиметр водна ст,110
1193,поддержать рекомендация национальный ассоциация ревматолог,110
1194,часть кл контрольный и,110
1195,организация экономический сотрудничество и,109
1196,автор сделать вывод о,109
1197,и магнитно-резонансный томография мрт,109
1198,один из главный задача,109
1199,автор быть показать что,109
1200,то же время дать,109
1201,с помощь программный обеспечение,109
1202,в шейный отдел позвоночник,109
1203,с увеличение продолжительность жизнь,109
1204,в о далее ы,109
1205,и качество медицинский помощь,109
1206,в зависимость от степень тяжесть,109
1207,сумма балл по шкала глисон,109
1208,через естественный родовой путь,109
1209,доза мг килограмм раз,109
1210,постановление правительство российский федерация от,108
1211,это необходимый отметить что,108
1212,фгбнуть ниир имя в,108
1213,и хронический обструктивный болезнь,108
1214,мочь быть рассмотреть как,108
1215,мочь вносить вклад в,108
1216,повышенный артериальный давление ада,108
1217,на качественно новый уровень,108
1218,некоторый исследователь считать что,108
1219,отделение от энтезис резекция,108
1220,от энтезис резекция бугристость,108
1221,в опухоль молочный железа,108
1222,др к сож нанопроволока,108
1223,он слабо влиять на,108
1224,сад мм рт ст дада мм рт ст,107
1225,и сахарный диабет сд,107
1226,не стоить забывать что,107
1227,в течение несколько минута,107
1228,на плата дпереть мство,107
1229,форсировать жизненный ёмкость лёгкое фжеть,107
1230,с использование критерий стьюдента,107
1231,острый респираторный вирусный инфекция орвать,107
1232,мочь быть использовать и,107
1233,перекисный окисление липид и,107
1234,в условие общий анестезия,107
1235,пациент старший год с,107
1236,далее яльност плата дпереть мство,107
1237,с ра получать гибп,107
1238,приказ мз рф от,107
1239,год имт килограмм метр,107
1240,в настоящий момент нет,107
1241,в группа вич тб,107
1242,не выходить за предел,106
1243,несмотря на достигнутый успех в,106
1244,нарушение сердечный ритм и,106
1245,быть показать что этот,106
1246,зависимость от тот какой,106
1247,сыворотка кровь у больной,106
1248,на длинный плечо хромосома,106
1249,субъект российский федерация и,106
1250,один из самый частый причина,106
1251,у пациент молодой год,106
1252,и метод обследовать больной,106
1253,ли поп ро тот,106
1254,и сахарный диабет го тип,106
1255,тот число у ребёнок,106
1256,центральный нервный система в,106
1257,в индустриально развитый страна,106
1258,до конец не выяснить,105
1259,быть показать что для,105
1260,необходимый отметить что при,105
1261,с помощь полимеразный цепной реакция,105
1262,широкий предел от до,105
1263,дробный о это сантиметр,105
1264,до мл килограмм и,105
1265,у реципиент почечный трансплантат,105
1266,у больной хобласть с,105
1267,точка зора о кт,105
1268,содержание органический вещество в,105
1269,источник составить автор по,105
1270,сд го тип в,105
1271,мм рт ст у,104
1272,отделение интенсивный терапия и,104
1273,быть значительно ниже чем,104
1274,тем или иной причина,104
1275,не существовать единый мнение,104
1276,поражение периферический нервный система,104
1277,результат рандомизировать клинический исследование,104
1278,для лечение хронический боль,104
1279,по крайний мера частично,104
1280,указ президент российский федерация от,104
1281,результат использование металлический модульный,104
1282,использование металлический модульный конструкция,104
1283,конструкция при ревизионный эндопротезирование,104
1284,причина повторный вмешательство нестабильность конусаинфекция нестабильность компонент,104
1285,нестабильность конусаинфекция нестабильность компонент перелом,104
1286,результат использование костный аллотрансплантат,104
1287,использование костный аллотрансплантат при ревизионный эндопротезирование,104
1288,литература год время наблюденияпричина,104
1289,год время наблюденияпричина повторный вмешательство асептический расшатывание,104
