,0,1
0,в то же время,15546
1,несмотря на то что,5828
2,свидетельствовать о тот что,4856
3,мочь быть связать с,3162
4,играть важный роль в,2603
5,в тот или иной,1966
6,то же время в,1631
7,в начало х год,1613
8,в доза мг сут,1602
9,в тот случай когда,1528
10,в раз выше чем,1507
11,исследование быть показать что,1425
12,следовать отметить что в,1384
13,по данные разный автор,1330
14,в доза мг килограмм,1259
15,мочь быть использовать для,1224
16,тем не менее в,1207
17,до сей пора не,1193
18,являться один из основный,1124
19,не выявить ассоциация с,1111
20,и соавт показать что,1090
21,в исследование быть включить,1046
22,в ранний послеоперационный период,1041
23,на мм рт ст,1007
24,в конец х год,955
25,в режим реальный время,872
26,в реальный клинический практика,860
27,в возраст старший год,842
28,в многое зависеть от,802
29,играть ключевой роль в,802
30,до настоящий время не,800
31,что мочь привести к,786
32,в подавлять большинство случай,753
33,мочь быть использовать в,753
34,до тот пора пока,733
35,в свой очередь приводить к,732
36,тот или иной степень,727
37,являться один из важный,722
38,прислать к вывод что,722
39,в раз чаща чем,717
40,являться один из наиболее,693
41,работа быть показать что,690
42,дать свидетельствовать о тот,684
43,в середина х год,665
44,по данные ряд автор,664
45,один из основный причина,636
46,раз выше чем в,629
47,с высокий риск развитие,617
48,можно сделать вывод что,615
49,на тысяча население в,613
50,в отделение интенсивный терапия,598
51,исследование свидетельствовать о тот,592
52,нестероидный противовоспалительный препарат нпвп,592
53,быть показать что при,585
54,с избыточный масса тело,574
55,исследование быть включить пациент,573
56,необходимый отметить что в,569
57,на территория российский федерация,569
58,говорить о тот что,561
59,случай на тысяча население,555
60,с начало х год,554
61,оказывать существенный влияние на,550
62,хронический обструктивный болезнь лёгкое,548
63,с нормальный масса тело,539
64,острый нарушение мозговой кровообращение,534
65,хронический обструктивный болезнь лёгкое хобласть,530
66,на сегодняшний день в,525
67,играть важный роль в,525
68,предположение о тот что,523
69,быть показать что в,519
70,позволять сделать вывод о,517
71,у лицо старший год,501
72,что мочь быть связать,497
73,являться тот факт что,493
74,приходить к вывод что,490
75,до мм рт ст,490
76,являться один из самый,485
77,с повышенный риск развитие,482
78,мм рт ст и,480
79,с сд го тип,478
80,то же время при,472
81,по крайний мера в,472
82,на протяжение многий год,465
83,и др к сож,464
84,ранее быть показать что,454
85,у пациент старший год,454
86,в основное за счёт,449
87,это мочь быть связать,446
88,быть показать что у,441
89,не отличаться от таковой,441
90,в раз большой чем,441
91,доза мг раз в,440
92,на трасса метр расстояние между точка подвес,437
93,расстояние между точка подвес лента рассчитать по,437
94,лента рассчитать по зависимость,437
95,раз выше чем у,434
96,далее метр наш профессор,433
97,год до наш э,431
98,который мочь быть использовать,428
99,в больший степень чем,427
100,в доза мг раз,422
101,генно-инженерный биологический препарат гибп,419
102,скф мл мина метр,414
103,являться фактор риска развитие,411
104,гипотеза о тот что,409
105,это обусловить тем что,404
106,в каждый конкретный случай,404
107,один из наиболее важный,403
108,исследование быть установить что,396
109,мм рт ст в,395
110,дать для расчёт ндс,394
111,для расчёт ндс и,394
112,и оптимизация мк нсприводной подвеска,394
113,метр угол естественный откос груз град грскорость,394
114,откос груз град грскорость транспортирование расчётный метр,394
115,транспортирование расчётный метр с,394
116,с пшаг установка подвеска,394
117,пшаг установка подвеска на трасса метр,394
118,ля ция эк с,392
119,с прес сей груп пы,392
120,в дп дно до,391
121,с середина х год,390
122,на ранний стадия заболевание,388
123,и мм рт ст,387
124,тот факт что в,387
125,и тот факт что,385
126,по данные некоторый автор,384
127,начало х год в,381
128,менее мм рт ст,381
129,следовать также отметить что,376
130,можно сделать вывод о,373
131,год средний возраст год,369
132,избыточный масса тело и,366
133,га ткф га ткф га ткф га ткф,364
134,мочь приводить к развитие,362
135,ишемический болезнь сердце и,359
136,хронический болезнь почка хбп,356
137,с конец х год,352
138,мочь оказывать влияние на,351
139,транспортировать груз том метр угол естественный,351
140,метр лраспределенный нагрузка от лента наш,351
141,к горизонт борт лента рассчитать по,351
142,к приводной подвеска с,351
143,что мочь приводить к,350
144,но тем не менее,349
145,и только тогда когда,348
146,в многий страна мир,347
147,являться один из ключевой,346
148,тот или иной вид,346
149,также быть показать что,344
150,составить на тысяча население,344
151,с длина волна нм,342
152,что мочь свидетельствовать о,342
153,аналогичный результат быть получить,342
154,быть включить пациент с,339
155,это свидетельствовать о тот,339
156,в значительный степень зависеть от,338
157,с ограниченный возможность здоровье,337
158,соавт быть показать что,336
159,в центральный нервный система,336
160,в литература иметься дать,336
161,центральный нервный система цнс,335
162,не вызывать сомнение что,334
163,при прочий равный условие,332
164,ввп на душить население,332
165,который мочь привести к,329
166,в до наш э,329
167,должный быть направить на,329
168,следовать обратить внимание на,329
169,с острый коронарный синдром,327
170,метр объёмный плотность транспортировать груз том,326
171,оказывать негативный влияние на,325
172,нарушение толерантность к глюкоза,323
173,в рутинный клинический практика,323
174,федеральный орган исполнительный власть,322
175,и структура левый желудочек,322
176,результат быть получить и,320
177,в й линия терапия,318
178,цель настоящий работа являться,317
179,то же время у,317
180,оптимизация мк нсприводной подвеска дать,317
181,метр угол наклон к горизонт борт,317
182,ишемический болезнь сердце ибс и,316
183,рак молочный железа и,316
184,ми о кара да,315
185,не оказывать существенный влияние,315
186,доза мг сут в,314
187,в раз ниже чем,314
188,с ишемический болезнь сердце,311
189,автор прислать к вывод,311
190,это объясняться тем что,306
191,в течение последний десятилетие,306
192,на сегодняшний день являться,306
193,результат быть получить в,303
194,говорят о тот что,303
195,в это же время,303
196,однако следовать отметить что,302
197,в раз маленький чем,302
198,оказывать положительный влияние на,302
199,в нижний часть спина,302
200,играть существенный роль в,302
201,мочь привести к развитие,301
202,и интенсивный терапия орита,301
203,литература иметься дать о,301
204,учитывать тот факт что,300
205,независимо друг от друг,300
206,дать болгария наш дать болгария наш,300
207,зависеть от многий фактор,297
208,в течение несколько день,297
209,и соавт сообщить о,296
210,тот или иной мера,296
211,в непосредственный близость от,295
212,колебаться от до в,295
213,у лицо пожилое возраст,294
214,ил ил ил ил ил ил ил ил,293
215,с практический точка зрение,292
216,на начальный этап сформировать каркасный,292
217,на протяжение последний год,291
218,в малое круг кровообращение,291
219,к настоящий время в,289
220,активный форма кислород афк,289
221,это следовать отметить что,289
222,век до наш э,287
223,фактор некроз опухоль и,286
224,на сегодняшний день не,283
225,год быть опубликовать результат,283
226,зависимость метр объёмный плотность,283
227,являться независимый фактор риска,282
228,качество пример можно привести,282
229,прес сей груп пы ге новый ре гу,280
230,ге новый ре гу ля ция эк,280
231,свидетельствующий о тот что,278
232,на тот или иной,278
233,варьировать от до в,277
234,в конечный итог приводить к,276
235,мочь быть использовать при,275
236,в х год прошлое век,275
237,мм рт ст при,274
238,при длина волна нм,274
239,мг дл мм час мг дл мм час,274
240,с сторона сердечно-сосудистый система,271
241,мочь быть использовать как,269
242,однако до сей пора,268
243,у лицо молодой возраст,267
244,который играть важный роль,266
245,прийти к вывод что,266
246,с деркач а а,266
247,ни один из они,265
248,один из основный задача,265
249,в зависимость от полый,265
250,у больной сд тип,265
251,поражение центральный нервный система,265
252,конец х год в,264
253,в структура онкологический заболеваемость,264
254,соэ мм число срб мг литр,264
255,на момент постановка диагноз,263
256,российский академия народный хозяйство и,263
257,более мм рт ст,263
258,у боль ных с,261
259,однако до настоящий время,261
260,быть разделить на группа,261
261,государственный служба при президент рф,261
262,являться один из главный,260
263,у больной сахарный диабет,258
264,исследование быть включить больной,258
265,тетр га га га га га тетр га,258
266,начальный этап сформировать каркасный модельмк нсприводной подвеска сантиметр,258
267,модельмк нсприводной подвеска сантиметр рисунок,258
268,с возрастание риска развить тия,255
269,некоторый автор считать что,254
270,можно разделить на два,253
271,качество пищевой продукт и,251
272,индекс масса тело килограмм метр,251
273,и мочь быть использовать,251
274,к тот или иной,251
275,в условие искусственный кровообращение,251
276,до конец не ясный,250
277,у ребёнок старший год,250
278,в экономически развитый страна,250
279,при обширный абдоминальный операция,250
280,являться один из наиболее распространить,249
281,это мочь привести к,249
282,что приводить к уменьшение,249
283,в течение мес после,248
284,у ребёнок младший год,248
285,ранее мы быть показать что,248
286,быть достоверно выше чем,247
287,на душить население в,247
288,в суточный доза мг,245
289,быть сделать вывод о,245
290,системный заболевание соединительный ткань,245
291,пациент быть разделить на,245
292,по данные всемирный организация здравоохранение,245
293,с молекулярный масса кда,244
294,быть сделать вывод что,244
295,в повседневный клинический практика,244
296,в относительный площадь поперечный сечение,240
297,относительный площадь поперечный сечение в,240
298,по зависимость единица рассчитать,240
299,зависимость единица рассчитать по,240
300,не говорить уже о,239
301,комбинированный терапия мт и,239
302,с хронический сердечный недостаточность,238
303,на е сутки после,238
304,найти свой отражение в,237
305,и фактор некроз опухоль,237
306,год быть показать что,237
307,тысяча до наш э,237
308,с прес сей ген,237
309,вносить существенный вклад в,236
310,после выписка из стационар,235
311,независимый фактор риска развитие,235
312,ниже мм рт ст,235
313,в течение месяц после,234
314,как видно из табла,234
315,е год прошлое век,234
316,что вероятно связать с,234
317,на один план выходить,233
318,быть установить что в,233
319,в прямая зависимость от,232
320,как видно из таблица,232
321,от лента наш метр лраспределенный нагрузка,231
322,получить широкий распространение в,230
323,один из важный задача,230
324,доза мг килограмм в,230
325,с сторона желудочно-кишечный тракт,230
326,в место лишение свобода,230
327,существующий на сегодняшний день,229
328,показать что у больной,229
329,тем не менее при,228
330,и соавт установить что,228
331,быть высказать предположение что,228
332,вестник кемеровский государственный университет том,228
333,более высокий риск развитие,228
334,в рандомизировать клинический исследование,228
335,к конец х год,228
336,в поясничный отдел позвоночник,226
337,в страна западный европа,225
338,отличаться друг от друг,225
339,как видно из рис,224
340,один половина х год,224
341,ре гу ля ция эк,224
342,конец х начало х год,223
343,важный отметить что в,222
344,и играть важный роль,222
345,исходить из тот что,222
346,у ребёнок старший возраст,221
347,и улучшение качество жизнь,221
348,на наш взгляд являться,221
349,московский государственный университет имя метр,221
350,тот пора пока не,220
351,быть достоверно ниже чем,219
352,таблица значение число итерация,219
353,который быть показать что,218
354,в значительный степень определяться,218
355,играть ведущий роль в,218
356,смертность от сердечно-сосудистый заболевание,217
357,в более поздний срок,217
358,в течение несколько часы,217
359,определяться по формула где,216
360,или по крайний мера,216
361,коленный сустав по данные литература,216
362,по крайний мера один,215
363,следовать отметить что при,215
364,выбор тот или иной,214
365,в итог приводить к,214
366,в разный страна мир,213
367,мужчина средний возраст год,213
368,что мочь быть обусловить,213
369,в результат что происходить,212
370,метр над ур метр,211
371,на сегодняшний день дать,210
372,в два половина х год,209
373,для решение поставить задача,209
374,обращение за медицинский помощь,209
375,достижение целевой уровень ада,209
376,в регионарный лимфатический узел,208
377,на протяжение всего период,208
378,быть значительно выше чем,208
379,в рандомизировать контролировать исследование,208
380,один из важный фактор,208
381,при ревизионный эндопротезирование коленный сустав по данные,208
382,наблюдение причина повторный вмешательство,208
383,который быть включить пациент,207
384,то же время для,207
385,принимать активный участие в,206
386,себя внимание тот факт что,206
387,что влечь за себя,206
388,и периферический нервный система,206
389,показать что у больной,206
390,обозначениетехнический характеристикавеличина единица измерение обозначениетехнический характеристикавеличина единица измерение,206
391,уровень пёс нг мл,205
392,постановление правительство рф от,204
393,мм рт ст а,204
394,тот или иной форма,204
395,в последний два десятилетие,203
396,пациент средний возраст год,203
397,в бухгалтерський область ку,203
398,это говорить о тот,201
399,образование активный форма кислород,201
400,в настоящий работа мы,201
401,можно условно разделить на,200
402,найти широкий применение в,200
403,до настоящий время оставаться,200
404,тот число у больной,199
405,доход на душить население,198
406,стоить отметить что в,198
407,занимать е место в,198
408,метр ширина лента метр ширина лента,197
409,лента рассчитать по зависимость град усилие приложить,197
410,зависимость град усилие приложить к приводной подвеска,197
411,являться независимый фактор риска развитие,196
412,проблема особо опасный инфекция вып,196
413,в свой очередь вести к,196
414,позволять сделать вывод что,196
415,активный форма кислород и,196
416,раз выше по сравнение с,194
417,в один часы после,194
418,рассматриваться как один из,194
419,в конец х начало х,193
420,с хронический болезнь почка,193
421,так быть показать что,193
422,что по мнение автор,192
423,рандомизировать клинический исследование рки,192
424,последний год показать что,192
425,у ребёнок младший возраст,192
426,с атеросклероз сонный артерия,192
427,наностержень нанодиск нанопроволока и,192
428,при принятие решение о,191
429,в ранее провести исследование,190
430,снижение скорость клубочковый фильтрация,190
431,качество один из основный,190
432,можно предположить что в,189
433,ия или тиа в,189
434,для достижение поставить цель,189
435,в относительный единица рассчитать,189
436,относительный единица рассчитать по,189
437,из таблица видно что,188
438,при острый повреждение гм,188
439,с острый повреждение гм,188
440,в х год прошлое столетие,187
441,пациент старший возрастной группа,187
442,инфекция верхний дыхательный путь,187
443,в доза внутренний облучение,187
444,и соавт продемонстрировать что,186
445,середина х год в,186
446,без определение национальный принадлежность,186
447,определение национальный принадлежность пациент,186
448,и до сей пора,185
449,в доступный литература мы,185
450,пик заболеваемость приходиться на,185
451,развитие налоговый система ипэя,185
452,налоговый система ипэя российский академия народный хозяйство,185
453,значение число итерация получить,185
454,результат быть получить при,184
455,число срб мг литр,184
456,с ия или тиа,184
457,уровень артериальный давление ада,183
458,и по сеять день,183
459,не мочь быть использовать,183
