,0,1
1708,тем не менее и,88
1709,статистически значимый различие между группа,88
1710,от ме ча ет ся,88
1711,также быть установить что,88
1712,мочь зависеть не только,88
1713,ограниченный возможность здоровье и,88
1714,колебаться от до год,88
1715,на первое этап исследование,88
1716,острый период инфаркт миокард,88
1717,один из самый сложный,88
1718,индекс масса миокард левый желудочек,88
1719,качество терапия й линия,88
1720,а по некоторые данные,88
1721,для тот чтобы избежать,88
1722,влияние ингаляционный анестетик на,88
1723,толщина стенка левый желудочек и,88
1724,имя инфаркт миокард ка коронарный артерия,88
1725,известно что у больной,87
1726,мочь быть получить из,87
1727,один из наиболее распространить заболевание,87
1728,тем не менее по,87
1729,при выписка из стационар,87
1730,мочь быть реализовать в,87
1731,тот число на фон,87
1732,эффективность тот или иной,87
1733,подход к решение задача,87
1734,как видно из представить,87
1735,за последний десять год,87
1736,до настоящий время нет,87
1737,хронический сердечный недостаточность в,87
1738,табла как видно из,87
1739,один из главный фактор,87
1740,один из ключевой роль в,87
1741,по данные литература при,87
1742,сахарный диабет тип и,87
1743,имя не выявить ассоциация,87
1744,воз ник но ве ния,87
1745,при хронический болезнь почка,87
1746,и диастолический артериальный давление,87
1747,также играть важный роль,87
1748,по данные литература у,87
1749,являться независимый предиктор развитие,87
1750,организация осуществлять образовательный деятельность,87
1751,и гладкомышечный клетка сосуд,87
1752,в период ранний юность,87
1753,ия ишемический инсульт имя инфаркт миокард,87
1754,изучить на сегодняшний день,87
1755,мочь быть полезный для,86
1756,в середина прошлое век,86
1757,управление по санитарный надзор,86
1758,известный на сегодняшний день,86
1759,открывать новое возможность для,86
1760,мочь быть основать на,86
1761,из объект окружающий среда,86
1762,акцентировать внимание на тот,86
1763,доступный литература мы не,86
1764,кро ме то го,86
1765,вычисляться по формула где,86
1766,играть важный роль при,86
1767,по принцип обратный связь,86
1768,в ближний послеоперационный период,86
1769,работа быть установить что,86
1770,на имущество физический лицо,86
1771,мочь привести к нарушение,86
1772,как уже упоминаться выше,86
1773,парциальный давление кислород в,86
1774,в результат что образоваться,86
1775,на ранний срок беременность,86
1776,международный рабочий группа по,86
1777,по сравне нию с,86
1778,быть достоверно выше по сравнение,86
1779,что соответствовать данные литература,86
1780,не мочь быть объяснить,86
1781,в конденсат выдыхать воздух,86
1782,дослый дженя публа кац й,86
1783,в юркевич о о завадський,86
1784,юркевич о о завадський й,86
1785,сделать предположение о тот,86
1786,больной рак яичниковый в,86
1787,течение число ткф трикальцийфосфат,86
1788,число ткф трикальцийфосфат тетр тетрагональный межплоскостной расстояние,86
1789,тетр тетрагональный межплоскостной расстояние отношение интенсивность рефлекс,86
1790,отношение интенсивность рефлекс к,86
1791,га га ткф га га ткф тетр ткф,86
1792,га ткф тетр ткф га га га ткф,86
1793,га га га ткф га га га тетр,86
1794,га га га тетр га тетр га тетр,86
1795,га тетр га тетр ткф га га га,86
1796,ткф га га га га га га га,86
1797,га га га га га ткф га ткф,86
1798,га ткф га ткф тетр га га тетр,86
1799,тетр га га тетр га тетр га га,86
1800,га тетр га га тетр га га га,86
1801,га га тетр га га га га га,86
1802,га га га га тетр га га га,86
1803,га га тетр га тетр га га га,86
1804,га га тетр га тетр тетр га,86
1805,тетр тетр га использование,86
1806,на основа совместный осаждение,86
1807,основа совместный осаждение гидроксиапатит,86
1808,о влияние ингаляционный анестетик,86
1809,ин фарк тот ми о кара,85
1810,схожий результат быть получить,85
1811,это можно объяснить тем,85
1812,и охрана окружающий среда,85
1813,с высокий риск возникновение,85
1814,от декабрь год о,85
1815,тот или иной группа,85
1816,год после установление диагноз,85
1817,быть показать что пациент,85
1818,высокий достоверность свидетельствовать о,85
1819,при медиана наблюдение мес,85
1820,некоторый автор отмечать что,85
1821,у впервые выявить больной,85
1822,мочь существенно влиять на,85
1823,анал з останна х дослый дженя публа кац,85
1824,в наш серия наблюдение,85
1825,ипм имя метр в,85
1826,генерация активный форма кислород,85
1827,медиана й й перцентиль,85
1828,периферический кровь у больной,85
1829,за основа быть взять,85
1830,в начальный доза мг,85
1831,скорость клубочковый фильтрация мл мина,85
1832,близкий к тем который,85
1833,структура это означать что,85
1834,явление требовать дальнейший изучение,85
1835,и круговой мышца глаз,85
1836,и заметно отличаться от,85
1837,не оказывать ингибируть влияние,85
1838,элемент классификация мгэ основать преимущественно,85
1839,площадь поверхность сцепление свая в,85
1840,ответ на одиночный стимул,85
1841,у пациент стеноз ка,85
1842,пациент стеноз ка не,85
1843,группа риск выразить атеро,85
1844,риск выразить атеро риск неблагоприятный,85
1845,имя исследование француз британец,85
1846,исследование француз британец здоровый мужчина,85
1847,возраст год швед пациент,85
1848,год швед пациент перенести,85
1849,и кон трольный группа украинец,85
1850,кон трольный группа украинец образец аутопсия от,85
1851,образец аутопсия от пациент,85
1852,с установленный ным диагноз,85
1853,установленный ным диагноз ибс,85
1854,без ибс повышать риск,85
1855,ибс повышать риск развитие таблица продолжение,85
1856,развитие таблица продолжение аллель обнаружить ассоциация,85
1857,возрастание риска развить тия имя,85
1858,имя исследование американец разный,85
1859,исследование американец разный этнический принадлежность лицо,85
1860,и группа контроль финн,85
1861,группа контроль финн мужчина средний возраст,85
1862,с ангио графически нормальный,85
1863,ангио графически нормальный ка немец долгожитель мужчина,85
1864,ка немец долгожитель мужчина в,85
1865,человек контрольный группа хорват человек,85
1866,контрольный группа хорват человек с,85
1867,и контрольный группа мексиканец,85
1868,контрольный группа мексиканец с,85
1869,и здо ров пациент,85
1870,здо ров пациент не выявить ассоциация,85
1871,с атеросклероз аорта пациент,85
1872,атеросклероз аорта пациент с,85
1873,с провести ангиография атеросклероз аорта,85
1874,провести ангиография атеросклероз аорта и,85
1875,почечный артерия не выявить ассоциация,85
1876,с развитие рестеноз стент голландец,85
1877,развитие рестеноз стент голландец пациент,85
1878,ибс не выявить ассоциация,85
1879,с риска развитие атероскла,85
1880,риска развитие атероскла роза метаанализ исследование,85
1881,роза метаанализ исследование с,85
1882,с прогрес сирований атеросклероз,85
1883,прогрес сирований атеросклероз у,85
1884,с семейный гипереть холестеринемия пациент,85
1885,семейный гипереть холестеринемия пациент с,85
1886,и здоро вых лицо немец,85
1887,здоро вых лицо немец с,85
1888,и здоровый лицо американец разный,85
1889,здоровый лицо американец разный этнический принадлежность лицо,85
1890,и группа контроль итальянец,85
1891,группа контроль итальянец пациент,85
1892,ия исследование таблица продолжение,85
1893,исследование таблица продолжение аллель обнаружить ассоциация,85
1894,ия исследование белые европеец,85
1895,исследование белые европеец пациент,85
1896,лицо группа контроль китаец,85
1897,группа контроль китаец пациент,85
1898,с ия средний возраст,85
1899,ия средний возраст год,85
1900,год не выявить ассоциация,85
1901,с атеросклеротический пора жение ка,85
1902,атеросклеротический пора жение ка пациент,85
1903,средний возраст год риск развитие имя швед,85
1904,риск развитие имя швед пациент перенести,85
1905,кон трольный группа риск неблагоприятный,85
1906,ия не выявить ассоциация,85
1907,не выявить ассоциация немец,85
1908,здоровый лицо не выявить ассоциация,85
1909,ия исследование итальянец пациент,85
1910,исследование итальянец пациент голландец пациент,85
1911,с ангиографич ски нормальный,85
1912,ангиографич ски нормальный ка германец долгожитель мужчина,85
1913,ка германец долгожитель мужчина в,85
1914,человек контрольный группа мексиканец пациент,85
1915,контрольный группа мексиканец пациент с,85
1916,с развитие рестеноз стент,85
1917,развитие рестеноз стент пациент,85
1918,ибс таблица окончание аллель,85
1919,таблица окончание аллель обнаружить ассоциация популяция,85
1920,обнаружить ассоциация популяция объесть выборка ассоциировать,85
1921,объесть выборка ассоциировать с,85
1922,риска ия россия забайкальский,85
1923,ия россия забайкальский край,85
1924,с развитие имя итальянец,85
1925,развитие имя итальянец с,85
1926,с развитие ия китаец,85
1927,развитие ия китаец пациент,85
1928,ген не выявить ассоциация,85
1929,не выявить ассоциация не выявить ассоциация,85
1930,не выявить ассоциация аллеля,85
1931,с развитие имя хорват,85
1932,развитие имя хорват человек,85
1933,с не выявить ассоциация,85
1934,не выявить ассоциация ала леля,85
1935,лицо контрольный группа аллель ассоциировать,85
1936,в артериальный стена ке,85
1937,артериальный стена ке у женщина,85
1938,риска ре ной ангиопластик,85
1939,ре ной ангиопластик пониженный ным уровень,85
1940,пониженный ным уровень пациент,85
1941,человек контрольный группа соответ ственный,85
1942,контрольный группа соответ ственный ассоциировать,85
1943,с стеноз стент после успеший,85
1944,стеноз стент после успеший россия забайкальский край,85
1945,риска развитие ия примечание снижение,85
1946,ия примечание снижение увеличение,85
1947,увеличение ия ишемический инсульт,85
1948,ка коронарный артерия каг коронарография ссо-сосудистый осложнение,85
1949,каг коронарография ссо-сосудистый осложнение с,85
1950,с реактивный белка сахарный диабет,85
1951,реактивный белка сахарный диабет го тип,85
1952,с х год прошлое век,84
1953,не оказывать негативный влияние,84
1954,коллектив автор адрес для корреспонденция,84
1955,в качество пример рассмотреть,84
1956,фактор негативно влиять на,84
1957,иметь высокий риск развитие,84
1958,в условие рыночный экономика,84
1959,при рак толстой кишка,84
1960,в глобальный отчёт воз,84
1961,оказывать влияние не только,84
1962,на он доля приходиться,84
1963,от до тысяча рубль,84
1964,тот факт что у,84
1965,па то ло гии,84
1966,как видно из дать,84
1967,диастолический ада мм рт ст,84
1968,и у здоровый лицо,84
1969,не всегда коррелировать с,84
1970,в наш предыдущий публикация,84
1971,один из важный составлять,84
1972,ассоциация полиморфизм ген с,84
1973,в дп дальна сть,84
1974,далеко не всегда в,84
1975,конформационный изменение рецептор и,84
1976,ада мм рт ст и,84
1977,от до тысяча икра,84
1978,и изохорный теплоёмкость линия,84
1979,изохорный теплоёмкость линия в,84
1980,с сад дада мм рт,84
1981,как площадь под кривая,84
1982,мг дл мм час мг дл мг дл,84
1983,др к сож и,84
1984,она представлять себя сумма,84
1985,увеличение продолжительность жизнь и,83
1986,и выраженность побочный эффект,83
1987,приказ минздрав россия от,83
1988,к настоящий время провести,83
1989,применение тот или иной,83
1990,риска развитие сердечно-сосудистый осложнение,83
1991,оказывать повреждать действие на,83
1992,всемирный организация здравоохранение в,83
1993,год литр р р,83
1994,с помощь критерий стьюдента,83
1995,свидетельствовать тот факт что,83
1996,острый коронарный синдром с,83
1997,пациент старший возрастной группа,83
1998,у часто болеть ребёнок,83
1999,на душить население и,83
2000,хронический болезнь почка и,83
2001,избыточный масса тело или,83
2002,ф нансових ресурс в,83
2003,варьировать от до и,83
2004,блокада левый ножка пучок гиса,83
2005,и приходить к вывод,83
2006,в группа плацебо р,83
2007,на второе место по,83
2008,снижение сопротивление дыхательный путь,83
2009,но наиболее часто использовать,83
2010,в результат сокращение мышца,83
2011,в большинство случай применимый,83
2012,ченный тело описывать закон фурье равно количество тепло,83
2013,передать теплоноситель описывать закон ньютон-рихман мат мат ог,83
2014,ньютон-рихман мат мат ог стенка ог,83
2015,с смешанный фенотип хобласть,83
2016,при проведение дифференциальный диагностика,82
2017,с артериальный гипертония ага,82
2018,на наш взгляд это,82
2019,хронический сердечный недостаточность хсн и,82
2020,у больной скв в,82
2021,то же время показать что,82
2022,соавт показать что у,82
2023,закон укр ни про,82
2024,и артериальный гипертензия ага,82
2025,который так или иначе,82
2026,в люба момент время,82
2027,антибиотик широкий спектр действие,82
2028,существенно ниже чем в,82
2029,нарушение функция почка и,82
2030,на территория саратовский область,82
2031,хронический сердечный недостаточность и,82
2032,и на тысяча население,82
2033,сила рекомендация уровень достоверность доказательство,82
2034,снижение частота сердечный сокращение,82
2035,в отдалённый срок после,82
2036,нарушение функция почка при,82
2037,иметь ряд преимущество перед,82
2038,впервые выявить больной туберкулёз,82
2039,у больной рак молочный железа,82
2040,в гордый нко далее,82
2041,мониторинг нейромышечный проводимость нмп заключаться,82
2042,возбуждение весь эфферентный волокно,82
2043,весь эфферентный волокно нерв электрический стимуляция,82
2044,нерв электрический стимуляция периферический двигательный нерв,82
2045,периферический двигательный нерв как известно,82
2046,различный вид стимуляция одиночный,82
2047,вид стимуляция одиночный стимуляция четырехразрядный тетанический тс,82
2048,стимуляция четырехразрядный тетанический тс посттетанический подсчёт птп,82
2049,посттетанический подсчёт птп и,82
2050,и режим двойной вспышка,82
2051,режим двойной вспышка стимуляция,82
2052,на одиночный стимул или серия стимул,82
2053,или серия стимул с,82
2054,от до гц амплитуда сокращение мышца,82
2055,гц амплитуда сокращение мышца начинать снижаться когда заблокировать,82
2056,начинать снижаться когда заблокировать ацетилхолиновый рецептор ахра,82
2057,ацетилхолиновый рецептор ахра и,82
2058,и исчезать когда заблокировать рецептор,82
2059,исчезать когда заблокировать рецептор для,82
2060,ответ хотя поверхностный электрод,82
2061,хотя поверхностный электрод не всегда позволять создать,82
2062,не всегда позволять создать стимул супрамаксимальный величина,82
2063,стимул супрамаксимальный величина режим,82
2064,при стимуляция четыре супрамаксимальный,82
2065,стимуляция четыре супрамаксимальный стимул подавать,82
2066,с частота гц через,82
2067,частота гц через с,82
2068,стимуляция наиболее широко использоваться,82
2069,значение отношение амплитуда четыре,82
2070,отношение амплитуда четыре ответ,82
2071,и документировать он вид,82
2072,документировать он вид исходно,82
2073,весь четыре ответ одинаковый,82
2074,четыре ответ одинаковый и,82
2075,значение отношение близко к,82
2076,отношение близко к при,82
2077,в результат высокочастотный воздействие,82
2078,результат высокочастотный воздействие гц возникать повторяться,82
2079,гц возникать повторяться мышечный потенциал,82
2080,и постоянный мышечный сокращение,82
2081,постоянный мышечный сокращение тетанус,82
2082,в отсутствие нмб сокращение,82
2083,отсутствие нмб сокращение при,82
2084,при стимуляция частота гц,82
2085,стимуляция частота гц мочь сохраняться,82
2086,течение несколько секунда в,82
2087,клиника чаща использовать пятисекундный стимул,82
2088,использовать пятисекундный стимул с,82
2089,с частота гц вызывающий,82
2090,частота гц вызывающий такой,82
2091,напряжение мышца как максимальный произвольный,82
2092,как максимальный произвольный усилие птп заключаться,82
2093,усилие птп заключаться в,82
2094,в подача после тс,82
