,0,1
2095,подача после тс супрамаксимальный стимул,82
2096,с три секунда пятисекундный гц,82
2097,три секунда пятисекундный гц тс,82
2098,с подсчёт количество посттетанический ответ,82
2099,подсчёт количество посттетанический ответ птп использоваться для,82
2100,птп использоваться для оценка глубокий нмб,82
2101,оценка глубокий нмб когда,82
2102,необходимый стимуляция двойной вспышка,82
2103,стимуляция двойной вспышка позволять визуально,82
2104,и тактильно оценить остаточный нмб,82
2105,тактильно оценить остаточный нмб без регистрировать устройство,82
2106,без регистрировать устройство существовать несколько,82
2107,наиболее часто использовать два паттерн состоять,82
2108,два паттерн состоять из,82
2109,вспышка три короткий мс тетанический,82
2110,короткий мс тетанический импульс,82
2111,с последующий повторение два,82
2112,последующий повторение два такой,82
2113,по величина мышечный сокращение,82
2114,величина мышечный сокращение заключаться,82
2115,нанесение один вспышка состоять,82
2116,один вспышка состоять из,82
2117,из три гц тетанический,82
2118,три гц тетанический импульс длительность по,82
2119,импульс длительность по мс,82
2120,последующий через мс нанесение,82
2121,через мс нанесение два вспышка состоять из,82
2122,два вспышка состоять из два,82
2123,аналогичный импульс позволять сравнить вызвать,82
2124,позволять сравнить вызвать один,82
2125,и два вспышка ответ,82
2126,два вспышка ответ б льшея амплитуда,82
2127,б льшея амплитуда чем,82
2128,проведение стимуляция наиболее часто,82
2129,стимуляция наиболее часто использовать локтевой нерв,82
2130,использовать локтевой нерв который иннервировать мышца,82
2131,который иннервировать мышца приводить большой палец,82
2132,приводить большой палец кисть мышца отводить мизинец,82
2133,кисть мышца отводить мизинец короткий отводить мышца,82
2134,короткий отводить мышца большой палец кисть,82
2135,большой палец кисть и,82
2136,и тыльный межкостный мышца кисть,82
2137,тыльный межкостный мышца кисть для,82
2138,длительный время восстановление нмп поэтому,82
2139,восстановление нмп поэтому полный восстановление,82
2140,достоверность свидетельствовать о восстановление нмп,82
2141,и мышца гортань так,82
2142,мышца гортань так восстановление нмп,82
2143,до соответствовать восстановление нмп,82
2144,соответствовать восстановление нмп диафрагма,82
2145,доступный для стимуляция нерв,82
2146,для стимуляция нерв являться лицевой нерв,82
2147,являться лицевой нерв который,82
2148,в тот число иннервировать мышца,82
2149,тот число иннервировать мышца окружающий глаз,82
2150,и мышца сморщивать бровь метр,82
2151,мышца сморщивать бровь метр и,82
2152,с мышца гортань чувствительность,82
2153,мышца гортань чувствительность к,82
2154,к миорелаксант однако акцелеромиографический,82
2155,миорелаксант однако акцелеромиографический оценка нмп,82
2156,этот мышца мочь преувеличивать,82
2157,мышца мочь преувеличивать глубина блок,82
2158,принцип не всегда создавать достаточный,82
2159,не всегда создавать достаточный по,82
2160,и ускорение регистрация дать,82
2161,ускорение регистрация дать мониторинг нмп мочь быть,82
2162,мониторинг нмп мочь быть субъективный,82
2163,объективный хотя большинство анестезиолог,82
2164,хотя большинство анестезиолог мир,82
2165,в свой практика полагаться,82
2166,свой практика полагаться на,82
2167,и тактильный оценка ответ,82
2168,тактильный оценка ответ субъективный оценка глубина нмб,82
2169,субъективный оценка глубина нмб часто неадекватный увы исследование,82
2170,часто неадекватный увы исследование провести,82
2171,в дания германия великобритания,82
2172,дания германия великобритания и,82
2173,и мексика показать что,82
2174,мексика показать что только,82
2175,врач соответственно использовать хоть,82
2176,соответственно использовать хоть какой-то мониторинг нмп объективный,82
2177,какой-то мониторинг нмп объективный интраоперационный мониторинг нейромышечный передача,82
2178,интраоперационный мониторинг нейромышечный передача в,82
2179,франция использовать лишь анестезиолог,82
2180,использовать лишь анестезиолог при,82
2181,при однократный введение мр,82
2182,однократный введение мр и,82
2183,при введение поддерживать доза,82
2184,введение поддерживать доза в,82
2185,бразилия у бразильский анестезиолог,82
2186,у бразильский анестезиолог принять участие,82
2187,исследование рабочий место оснастить,82
2188,рабочий место оснастить монитор нмп этот,82
2189,монитор нмп этот результат,82
2190,результат близкий к тем,82
2191,заметно отличаться от цифра характерный для,82
2192,цифра характерный для страна ес последний,82
2193,страна ес последний версия британский стандарт анестезиологический,82
2194,версия британский стандарт анестезиологический мониторинг,82
2195,уже относить мониторинг нмп,82
2196,относить мониторинг нмп к,82
2197,предыдущий лишь требовать держать,82
2198,лишь требовать держать монитор наготове к,82
2199,монитор наготове к объективный,82
2200,ответ мышца относить электромиография,82
2201,мышца относить электромиография эмг механомиография ммг акцелеромиография,82
2202,эмг механомиография ммг акцелеромиография амг кинемиография кмг,82
2203,амг кинемиография кмг и,82
2204,и фономиография фмг эмг основываться,82
2205,фономиография фмг эмг основываться на,82
2206,на регистрация электрический активность,82
2207,регистрация электрический активность общий пд стимулировать мышца,82
2208,общий пд стимулировать мышца который предшествовать механический,82
2209,который предшествовать механический сокращение регистрировать электрод располагаться,82
2210,сокращение регистрировать электрод располагаться на,82
2211,на тело мышца референтный,82
2212,тело мышца референтный электрод,82
2213,место прикрепление сухожилие а электрод заземление,82
2214,а электрод заземление в,82
2215,удалённый место по данные эмг-сигнал можно,82
2216,по данные эмг-сигнал можно определить латентность амплитуда,82
2217,определить латентность амплитуда длительность,82
2218,и форма общий пд,82
2219,форма общий пд двигательный латентность являться,82
2220,двигательный латентность являться временной промежуток мс,82
2221,временной промежуток мс между,82
2222,начало появление вызвать двигательный,82
2223,появление вызвать двигательный ответ,82
2224,и суммарно отражать время,82
2225,суммарно отражать время проведение импульс,82
2226,проведение импульс по волокно двигательный,82
2227,по волокно двигательный нерв,82
2228,для нейромышечный передача латентность,82
2229,нейромышечный передача латентность также,82
2230,на скорость нейротрансмиссия повреждение,82
2231,скорость нейротрансмиссия повреждение нерв,82
2232,амплитуда общий мышечный пд,82
2233,общий мышечный пд мочь быть измерить,82
2234,мочь быть измерить от изоэлектрический линия,82
2235,от изоэлектрический линия до,82
2236,пик от отрицательный пик,82
2237,от отрицательный пик до,82
2238,площадь под кривая общий мышечный пд,82
2239,общий мышечный пд она,82
2240,представлять себя сумма амплитуда,82
2241,амплитуда отдельный мышечный волокно,82
2242,отдельный мышечный волокно активированный стимуляция длительность,82
2243,активированный стимуляция длительность и,82
2244,морфология общий мышечный пд,82
2245,общий мышечный пд давать информация о,82
2246,давать информация о синхронность,82
2247,и интенсивность мышечный сокращение,82
2248,интенсивность мышечный сокращение эмг-сигнал мочь искажать различный,82
2249,эмг-сигнал мочь искажать различный фактор электрический помеха,82
2250,фактор электрический помеха неправильно наложить электрод гипотермия,82
2251,неправильно наложить электрод гипотермия и,82
2252,прямая стимуляция мышца ммг позволять измерить,82
2253,мышца ммг позволять измерить фактический сила изометрический,82
2254,фактический сила изометрический сокращение,82
2255,с помощь силовой датчик,82
2256,помощь силовой датчик наиболее часто измеряться сила,82
2257,наиболее часто измеряться сила изометрический сокращение мышца отводить,82
2258,изометрический сокращение мышца отводить большой палец кисть,82
2259,большой палец кисть при стимуляция локтевой,82
2260,при стимуляция локтевой нерв мышца нахмуривать,82
2261,нерв мышца нахмуривать бровь,82
2262,круговой мышца глаз не,82
2263,ммг при стимуляция локтевой нерв,82
2264,стимуляция локтевой нерв большой палец воздействовать,82
2265,большой палец воздействовать на,82
2266,датчик сила сокращение преобразовываться,82
2267,электрический сигнал который усиливаться отображаться,82
2268,который усиливаться отображаться и,82
2269,весь метод мониторинг нмп,82
2270,метод мониторинг нмп ммг требовать наиболее,82
2271,ммг требовать наиболее тщательный подготовка,82
2272,в идеал мышца должный быть,82
2273,идеал мышца должный быть зафиксировать,82
2274,в специально вылить формочка для,82
2275,специально вылить формочка для предотвращение,82
2276,изменение положение даже незначительный,82
2277,положение даже незначительный отсоединение мышца от,82
2278,отсоединение мышца от прибор,82
2279,прибор мочь изменить амплитуда,82
2280,мочь изменить амплитуда вызвать,82
2281,сигнал также должный применяться,82
2282,также должный применяться постоянный преднагрузка соответствующий,82
2283,постоянный преднагрузка соответствующий размер,82
2284,и местоположение датчик датчик,82
2285,местоположение датчик датчик мочь воспринимать сила,82
2286,мочь воспринимать сила в,82
2287,большинство случай применимый в,82
2288,в условие недеполяризовать нмб,82
2289,условие недеполяризовать нмб однако,82
2290,в отсутствие блок генерировать,82
2291,отсутствие блок генерировать сила,82
2292,мочь привести к повреждение датчик прибор,82
2293,повреждение датчик прибор для ммг громоздкий,82
2294,для ммг громоздкий и,82
2295,и неудобный для применение,82
2296,неудобный для применение на,82
2297,метод являться по суть,82
2298,являться по суть механомиографический например баллонный,82
2299,механомиографический например баллонный метод,82
2300,для мониторинг нмп мышца гортань,82
2301,мониторинг нмп мышца гортань или мышца нахмуривать,82
2302,или мышца нахмуривать бровь сила измерять непрямой,82
2303,бровь сила измерять непрямой способ,82
2304,через изменение давление оказать,82
2305,изменение давление оказать на,82
2306,результат сокращение мышца они тоже трудно,82
2307,они тоже трудно применять,82
2308,в клиника амг измерять сила,82
2309,клиника амг измерять сила ответ,82
2310,ответ через ускорение стимулировать,82
2311,через ускорение стимулировать мышца,82
2312,основа два закон ньютон,82
2313,два закон ньютон если перемещать масса неизменный,82
2314,если перемещать масса неизменный ускорение прямо пропорциональный сила,82
2315,ускорение прямо пропорциональный сила ускорение измеряться,82
2316,с помощь пьезоэлектрический кристалл встроить,82
2317,помощь пьезоэлектрический кристалл встроить в,82
2318,в датчик который крепиться,82
2319,датчик который крепиться к стимулировать мышца,82
2320,к стимулировать мышца движение,82
2321,в пьезоэлектрический кристалл пропорциональный ускорение,82
2322,пьезоэлектрический кристалл пропорциональный ускорение мышца сигнал анализироваться,82
2323,мышца сигнал анализироваться и,82
2324,и отображаться несколько исследование,82
2325,отображаться несколько исследование показать хороший,82
2326,показать хороший корреляция между,82
2327,корреляция между значение получить акцелеромиографически,82
2328,значение получить акцелеромиографически и,82
2329,и механомиографически отклонение отношение,82
2330,механомиографически отклонение отношение получить,82
2331,амг от отношение эмг составлять,82
2332,отношение эмг составлять хотя амг менее точный,82
2333,хотя амг менее точный в,82
2334,в оценка нмп чем эмг,82
2335,оценка нмп чем эмг и,82
2336,и ммг именно этот,82
2337,ммг именно этот метод,82
2338,доступный для рутинный мониторинг,82
2339,для рутинный мониторинг нмп ввиду простота,82
2340,нмп ввиду простота использование,82
2341,на различный мышца кмг,82
2342,различный мышца кмг основать на,82
2343,и деформация пьезоэлектрический чувствительный гибкий,82
2344,деформация пьезоэлектрический чувствительный гибкий пластина,82
2345,результат движение большой палец,82
2346,движение большой палец вызвать,82
2347,в время стимуляция двигательный,82
2348,время стимуляция двигательный нерв формовать пластичный устройство,82
2349,нерв формовать пластичный устройство накладываться,82
2350,в вырезка между больший,82
2351,вырезка между больший и,82
2352,с помощь клейка лента,82
2353,помощь клейка лента в,82
2354,в время сокращение пьезоэлектрический,82
2355,время сокращение пьезоэлектрический пластина деформироваться,82
2356,и генерировать разность потенциал пропорциональный,82
2357,генерировать разность потенциал пропорциональный степень,82
2358,сгибание один исследование продемонстрировать хороший,82
2359,исследование продемонстрировать хороший согласованность,82
2360,недавний исследование показать что отношение,82
2361,не мочь быть взаимозаменяемый кмг,82
2362,мочь быть взаимозаменяемый кмг мочь применяться,82
2363,для оценка нмп фмг измерять,82
2364,оценка нмп фмг измерять нмп путём регистрация,82
2365,нмп путём регистрация специальный микрофон низкочастотный звук,82
2366,специальный микрофон низкочастотный звук возникать,82
2367,при сокращение мышца распространение звуковой,82
2368,сокращение мышца распространение звуковой волна,82
2369,происходить из-за пространственный смещение,82
2370,из-за пространственный смещение мышца,82
2371,сокращение сигнал можно регистрировать,82
2372,сигнал можно регистрировать с,82
2373,поверхность кожа показать что пик мощность,82
2374,показать что пик мощность типичный сигнал,82
2375,от до гц генерировать сигнал,82
2376,гц генерировать сигнал представить звук,82
2377,ниже гц поэтому важный чтоб,82
2378,поэтому важный чтоб микрофон обладать высокий,82
2379,микрофон обладать высокий чувствительность,82
2380,чувствительность к очень низкочастотный,82
2381,к очень низкочастотный звук,82
2382,звук результат ммг фмг,82
2383,результат ммг фмг и,82
2384,и кмг проявлять достаточный,82
2385,кмг проявлять достаточный соответствие,82
2386,на этап восстановление нмп,82
2387,этап восстановление нмп в,82
2388,при регистрация ответ фмг,82
2389,регистрация ответ фмг проявлять б льшуя,82
2390,проявлять б льшуя чувствительность чем амг,82
2391,чувствительность чем амг ммг,82
2392,и фмг являться взаимозаменяемый,82
2393,фмг являться взаимозаменяемый метод,82
2394,для такой образ обнаружить корреляция,82
2395,такой образ обнаружить корреляция между,82
2396,с помощь кмг фмг,82
2397,помощь кмг фмг и,82
2398,и ммг недостаточный для,82
2399,ммг недостаточный для исследовательский,82
2400,исследовательский цель но приемлемый,82
2401,цель но приемлемый для,82
2402,для клиника преимущество фмг,82
2403,клиника преимущество фмг заключаться,82
2404,тот что регистрировать вызвать,82
2405,что регистрировать вызвать ответ,82
2406,с люба интересовать мышца,82
2407,люба интересовать мышца она лёгкий,82
2408,и неинвазивный фмг благодаря,82
2409,неинвазивный фмг благодаря свой,82
2410,надёжный метод оценка нмп,82
2411,метод оценка нмп в,82
2412,повседневный практика что касаться,82
2413,на основа электрофизиологический картина,82
