text,freq
согласно рекомендациям европейского общества,220
в течение последних десятилетий,220
что с одной стороны,220
в раз больше чем,220
денежно кредитной политики в,220
в отделениях интенсивной терапии,220
дозе мг кг сут,220
у больных артериальной гипертонией,220
к тому же в,219
при этом несмотря на,219
на ммоль сут г,219
хор пл хор пл,219
сд го типа и,219
то время как на,219
при сд го типа,219
в качестве основы для,219
у больных ревматоидным артритом,219
за последние годы в,218
от до мг сут,218
в течение последнего десятилетия,218
кроме того было показано,218
по данным многочисленных исследований,218
федеральных государственных гражданских служащих,218
которые могут привести к,218
мг дл ммоль л,218
первичной медико санитарной помощи,218
мм рт ст для,217
в течение первых месяцев,217
у практически здоровых лиц,217
у пациентов резистентных к,217
помощью полимеразной цепной реакции,217
автореф дис канд психол,217
не вызывает сомнения что,217
рассматриваются одновременно стран доход,216
одновременно землевладение отрицательное для,216
всей выборки незначимое для,216
всей выборки стран доход,216
диастолической дисфункции левого желудочка,216
землевладению рассматриваются одновременно землевладение,216
джини метод наименьших квадратов,216
у лиц моложе лет,216
на тыс населения а,216
в раннем детском возрасте,216
зависимости от возраста и,216
добавляются региональные дамми переменные,216
человечески й капитал коэффициент,216
капитал коэффициент джини метод,216
коэффициент джини метод наименьших,216
наименьших квадратов доход отрицательное,216
и науки российской федерации,215
по причине того что,215
в регионах российской федерации,215
из таблицы видно что,215
в проведенном нами исследовании,215
имеет важное значение для,215
до сих пор в,215
и является одной из,215
в работах других авторов,215
всероссийского научного общества кардиологов,215
холестерина липопротеидов высокой плотности,215
толерантности к физическим нагрузкам,215
г до н э,215
к ним можно отнести,214
сосудистый эндотелиальный фактор роста,214
настоящее время существует большое,214
уровень с реактивного белка,214
в основе которого лежат,214
оказывает значительное влияние на,214
в странах восточной европы,214
и распределение электроэнергии газа,214
приводят к тому что,213
играет ведущую роль в,213
с государственным заданием ранхигс,213
не только за счет,213
среди лиц старше лет,213
острых нарушений мозгового кровообращения,213
двойное слепое плацебо контролируемое,213
материалов научно исследовательской работы,213
сосудистого эндотелиального фактора роста,213
форсированной жизненной емкости легких,213
у больных артериальной гипертензией,213
в составе комплексной терапии,212
на фоне проводимой терапии,212
в последние годы появились,212
выше чем у больных,212
в качестве исходных данных,212
может быть использована в,211
на кг массы тела,211
впервые выявленных больных туберкулезом,211
предел прочности при изгибе,211
той или иной форме,211
случая на тыс населения,211
анал з останн х,210
на фоне комбинированной терапии,210
лп мм рт ст,210
тогда как у пациентов,210
что по мнению авторов,210
могут оказывать влияние на,210
выдоха за ю секунду,209
ингибиторы ангиотензинпревращающего фермента иапф,209
настоящее время показано что,209
т д а также,209
у паци ентов с,209
и соавт обнаружили что,209
у пациентов находящихся на,209
с целью первичной профилактики,209
в зависимости от длительности,209
на наш взгляд в,209
нет единого мнения о,208
наблюдения причины повторных вмешательств,208
по данным исследования проведенного,208
перелом аллотрансплантата инфекция несвязанное,208
повторных вмешательств асептическое расшатывание,208
всемирная организация здравоохранения воз,208
активности симпатической нервной системы,208
в одном из последних,208
с хронической болезнью почек,208
на тот факт что,208
настоящее время считается что,208
некоторые авторы указывают на,208
чувствительность тканей к инсулину,207
могут быть отнесены к,207
республика дагестан брянская коса,207
на сегодняшний день является,207
до конца не изучены,207
начале х гг в,207
во время ик в,207
распределение электроэнергии газа и,207
и с другой стороны,207
авторы сделали вывод что,207
сердечно сосудистой смертности в,207
при этом по данным,206
коэффициент распределения кровь газ,206
единица измерения обозначениетехническая характеристикавеличина,206
рф данная работа подготовлена,206
у па циентов с,206
в рамках данной работы,206
на наш взгляд является,206
как было сказано выше,206
сумме инвестиций тыс руб,206
сумма баллов по шкале,206
с реактивного белка и,205
за тот же период,205
с соавторами показали что,205
в исследованиях последних лет,205
несмотря на значительные успехи,205
пяти липинского оценку ин,205
во второй половине хх,205
к выпускному отверстию оксигенатора,204
поддержания адекватной глубины анестезии,204
потока свежей газовой смеси,204
есть основания полагать что,204
хс лнп ммоль л,204
показателей летальности после кардиохирургических,204
загрязнение пространства операционной парами,204
в выпускном газе из,204
это приводит к тому,204
предположении о том что,203
однако необходимо отметить что,203
развития сердечно сосудистых осложнений,203
остается открытым вопрос о,203
х х х х,203
за последние два десятилетия,203
у больных инфарктом миокарда,203
мгту им н э,202
останн х досл джень,202
одной из самых частых,202
ингибиторы ангиотензин превращающего фермента,202
х годах прошлого столетия,202
у пострадавших й группы,202
на данный момент в,202
свидетельствовали о том что,202
также свидетельствуют о том,202
и до настоящего времени,202
по методике описанной в,201
в исследованиях показано что,201
отдельные законодательные акты российской,201
главным образом за счет,201
занимает е место среди,201
мат мат ог стенок,201
начале х годов прошлого,200
зп р р р,200
существенно выше чем в,200
в дозах мг сут,200
по видимому связано с,200
и является одним из,200
как уже было сказано,200
вносит существенный вклад в,200
таблица эффективность антиаритмических препаратов,200
р статистически значимые различия,199
в первые ч после,199
г на тыс населения,199
по сравнению со стандартной,198
что является одним из,198
у пациен тов с,198
хроническая болезнь почек хбп,198
эффекта переноса процентных ставок,198
мм рт ст диастолическое,198
кроме того имеются данные,198
по данным клинических исследований,198
раза выше по сравнению,198
годовых отчетов росселхозбанка сбербанка,198
продуктов перекисного окисления липидов,197
подвеске со стороны ленты,197
в возрасте лет мужчин,197
по данным нашего исследования,197
американцы немцы американцы американцы,197
по данным отечественных авторов,197
гу институт ревматологии рамн,197
в широких пределах от,196
в основе которых лежат,196
с атеросклерозом сонных артерий,196
в каждый момент времени,196
является одним из наиболее,196
следует отметить что для,196
до настоящего времени в,196
это означает что в,196
и соавт сообщили о,196
мл условно норма повышение,196
соглашений о распределении затрат,196
указом президента российской федерации,196
является одним из ведущих,196
была достоверно выше чем,195
если речь идет о,195
через мес после начала,195
к тому или иному,195
в течение месяцев после,195
эти результаты согласуются с,195
пришли к заключению что,195
до на тыс населения,195
группа группа группа группа,195
со стабильной стенокардией напряжения,194
мы имеем дело с,194
в состав которых входят,193
а также с учетом,193
прежде всего за счет,193
однофотонной эмиссионной компьютерной томографии,193
по данным фремингемского исследования,193
холестерина липопротеинов высокой плотности,193
х годов прошлого столетия,192
по данным федеральной службы,192
одним из наиболее перспективных,192
мнк кохен д сото,192
онмк острое нарушение мозгового,192
в течение первых двух,192
в эксперименте показано что,192
л хс лпнп ммоль,191
в странах европейского союза,191
с этой целью в,191
в европейских рекомендациях по,191
вне зависимости от того,190
а также из за,190
с клинической точки зрения,190
на от исходного значения,190
должна быть направлена на,190
в дополнение к этому,190
данных о том что,190
с соавт показали что,190
использованием пакета прикладных программ,190
к сожа наностержни нанодиски,190
одной из основных проблем,190
дозе мг кг массы,190
по критерию манна уитни,189
и сердечно сосудистой системы,189
в средствах массовой информации,189
руб итоговый доход вкладчика,188
нг мл нг мл,188
при решении вопроса о,188
относительных единицах рассчитанная по,188
материал россия республика дагестан,188
при остром повреждении гм,188
массой тела при рождении,188
у лиц пожилого и,188
в последнее время появились,188
в течение ближайших лет,188
однако несмотря на то,188
по крайней мере частично,187
генно инженерные биологические препараты,187
и человек группа контроля,187
по видам экономической деятельности,187
за последние несколько лет,187
в й линии терапии,187
в конце прошлого века,187
и средним уровнем дохода,186
в группе высокого риска,186
занимает е место в,186
развития сердечно сосудистых заболеваний,186
с низкой массой тела,186
в течение долгого времени,186
с одной стороны как,186
определения национальной принадлежности пациентов,186
показали что у больных,186
статистически значимых различий между,186
скорости распространения пульсовой волны,186
может привести к возникновению,186
экспериментальные исследования показали что,186
контроль физ р р,186
не всегда приводит к,185
также следует отметить что,185
в доступной нам литературе,185
в рамках данного подхода,185
ии или тиа в,185
в тех или иных,185
на данный момент не,185
толщины комплекса интима медиа,185
к сожа нанодиски нанопроволоки,185
некоторые исследователи считают что,185
одной из важнейших задач,184
сердечно сосудистой системы ссс,184
сад систолическое артериальное давление,184
может приводить к увеличению,184
играющих важную роль в,184
на качество жизни пациентов,184
в доступной литературе мы,184
с ии или тиа,184
у пациентов пожилого и,184
необходимо обратить внимание на,184
у здоровых лиц и,184
у лиц мужского пола,184
на ранних этапах развития,184
н дн дн д,184
окс с подъемом сегмента,183
в результате проведенного исследования,183
приводит к значительному снижению,183
у больных перенесших инфаркт,183
поддержано рекомендациями национальных ассоциаций,183
через мес через мес,183
по мнению многих исследователей,183
базисных противовоспалительных препаратов бпвп,182
к началу х гг,182
к концу х гг,182
н д сентябрь н,182
липопротеидов низкой плотности лпнп,182
показатель группа группа группа,182
у пациентов старческого возраста,181
в различных регионах мира,181
обращают на себя внимание,181
в индустриально развитых странах,181
нд нд нд нд,181
ммоль л таг моль,180
рекомендациях европейского общества кардиологов,180
таким образом можно предположить,180
нет данных нет данных,180
кроме того по данным,180
тыс руб размер надбавки,180
при продажах через ук,180
на достаточно высоком уровне,180
активных форм кислорода и,180
авторы делают вывод что,180
атеросклерозом сонных артерий и,180
исследование были включены пациентов,180
ме ии гл ммоль,180
возрасте лет средний возраст,179
при этом необходимо отметить,179
мг кг мг кг,179
можно представить следующим образом,179
цель исследования оценить эффективность,179
в более ранних исследованиях,179
а также то что,179
в ранние сроки после,179
и играет важную роль,179
то же время как,179
для решения поставленной задачи,179
экспертов всемирной организации здравоохранения,179
для достижения поставленной цели,178
в настоящее время известны,178
и фактора некроза опухоли,178
и американской ассоциации сердца,178
представляет собой один из,178
многочисленных исследованиях показано что,178
реакции трансплантат против хозяина,178
которые могут влиять на,178
одной из возможных причин,178
экстремально низкой массой тела,178
несмотря на достигнутые успехи,178
скорость клубочковой фильтрации скф,177
у женщин старше лет,177
нельзя не отметить что,177
в более раннем возрасте,177
низкой плотности хс лпнп,177
можно сделать следующие выводы,177
по мнению других авторов,176
выше чем у мужчин,176
значимые различия по сравнению,176
приводит к значительному увеличению,176
у пациентов обеих групп,176
концепции долгосрочного социально экономического,176
и по отношению к,176
с целью повышения эффективности,176
у больных сд и,176
мировых цен на нефть,176
у больных хобл в,175
к м н доцент,175
статистически значимых различий в,175
в более поздней работе,175
его вверх по отвалу,175
по срав нению с,175
риска сердечно сосудистых заболеваний,175
до конца не изучен,175
на е сутки после,175
с хронической почечной недостаточностью,175
и могут быть использованы,175
и сахарным диабетом типа,175
у больных перенесших инсульт,175
лг я группа больные,175
образованием сырого файла дальнейшее,175
зависимости от наличия умеренной,175
сердечно сосудистыми заболеваниями ссз,175
л хс лпвп ммоль,175
умеренной лг я группа,175
побочные эффекты прорывные судорожные,175
а также при наличии,175
с результатами других исследований,174
свидетельствующие о том что,174
находит свое отражение в,174
позволяет сделать вывод что,174
в которое было включено,174
и сердечно сосудистых осложнений,174
частота сердечных сокращений чсс,174
ингибиторы фактора некроза опухоли,174
по поводу сердечной недостаточности,174
дч дс оппр опор,174
по мере прогрессирования заболевания,173
с позиций доказательной медицины,173
у пациентов оперированных в,173
на стационарном лечении в,173
в течение всей операции,173
вносит свой вклад в,173
ишемией головного мозга и,173
с помощью программного обеспечения,173
сходные данные были получены,173
приводит к снижению частоты,173
позволяют сделать вывод о,173
ниже чем у пациентов,173
данные литературы свидетельствуют о,173
рака молочной железы рмж,173
е сутки после операции,172
сделать вывод о том,172
счет сш счет эд,172
ломоносова географический факультет кафедра,172
эффективности контрольно надзорной деятельности,172
указ президента российской федерации,172
по данным суточного мониторирования,172
в течение первых дней,172
в среднем через мес,172
с ишемией головного мозга,172
у здоровых лиц в,172
значительно ниже чем в,172
до н э в,172
с контрольной группой в,172
с конца х годов,172
в зал петра великого,172
в сфере государственного управления,171
по новому взглянуть на,171
сделан вывод о том,171
у пациентов контрольной группы,171
методом полимеразной цепной реакции,170
данные каф экологии двфу,170
риск неблагоприятного про гноза,170
ммоль л триглицериды ммоль,170
таблица продолжение аллель обнаруженная,170
у больных хроническим гепатитом,170
контрольной группы китайцы человек,170
мг сут мг сут,170
по данным эпидемиологического исследования,170
к началу х годов,170
американцы разной этнической принадлежности,170
про гноза после перенесенного,170
головного мозга а также,170
возрасте лет мужчин с,170
при сердечно сосудистых заболеваниях,170
в течение нескольких месяцев,170
и лиц группа контроля,170
этнической принадлежности лиц с,170
человек группа контроля пациентов,170
