text,freq
предположения о том что,147
у пациентов детского возраста,147
можно выделить два основных,147
настоящее время активно изучается,146
получены данные о том,146
за счет бюджетных средств,146
одно из первых мест,146
мс мс мс мс,146
л охс ммоль л,146
в отдаленном послеоперационном периоде,146
в данной работе рассматривается,146
в связи со снижением,146
что приводит к потере,146
составляет от общего числа,146
была значительно выше чем,146
для достижения этой цели,146
играет решающую роль в,146
что позволяет использовать его,146
с последующим переходом на,146
имеет большое значение в,146
ранее было установлено что,146
визуальной аналоговой шкале ваш,146
толщина комплекса интима медиа,146
странах юго восточной азии,145
н прсила прижатия прижимного,145
статистически значимые различия между,145
ряде работ было показано,145
к которым относится и,145
мм рт ст с,145
существенно ниже чем в,145
при ишемической болезни сердца,145
во время беременности в,145
уровня артериального давления ад,145
на имущество физических лиц,145
в сфере охраны здоровья,145
факторов сердечно сосудистого риска,145
зависимости от стадии заболевания,145
авторы делают вывод о,145
одно из наиболее распространенных,145
расчете на таможенный пост,144
на тыс детского населения,144
с помощью этого метода,144
во многом связано с,144
в настоящее вре мя,144
к м н ассистент,144
определяется по формуле где,144
может повлечь за собой,144
в дозе мг сутки,144
исследование были включены больных,144
на таможенный пост расположенный,144
том числе на основе,144
при этом известно что,144
по результатам нашего исследования,144
циклическому цитруллинированному пептиду аццп,144
исследование всемирного банка рисунок,144
у пациентов получавших дексмедетомидин,144
товарам облагаемым пошлинами по,144
фтс источник фтс россии,144
таможенном управлении фтс источник,144
у больных при этом,144
профилактике заболеваемости рекомендует уровень,144
применения дексмедетомидина у пациентов,144
данном региональном таможенном управлении,144
медиана выживаемости без прогрессирования,143
относительный риск ор доверительный,143
конце х годов прошлого,143
с увеличением продолжительности жизни,143
и к тому же,143
и средней степени тяжести,143
с высоким уровнем дохода,143
о том что при,143
том числе с учетом,143
была ниже чем в,143
и может привести к,143
с артериальной гипертензией аг,143
по данным разных исследователей,143
в дозе мг раз,143
с целью оценки эффективности,143
вопросы современной педиатрии введение,142
существуют данные о том,142
федеральных государственных образовательных стандартов,142
приводит к повышению уровня,142
систолической функции левого желудочка,142
при этом показано что,142
одной из главных проблем,142
фактора некроза опухоли и,142
целью нашего исследования было,142
и европейского общества кардиологов,142
было показано что наличие,142
врп на душу населения,142
на обоих этапах исследования,142
на вопрос о том,142
в настоящее время разработаны,142
дозе мг р сут,142
на рынке труда и,142
в сыворотке крови определяли,142
у значительной части пациентов,142
сыворотке крови у пациентов,141
статистическую обработку полученных результатов,141
различных регионах российской федерации,141
значительно выше по сравнению,141
ингибиторов ангиотензинпревращающего фермента иапф,141
значительной степени зависят от,141
в свою очередь влияет,141
комбинированной терапии мт и,141
приводит не только к,141
на поздних стадиях заболевания,141
у данной группы больных,141
возрастной группе от до,141
в коем случае не,141
не отличалась от таковой,141
как уже упоминалось выше,141
с острым повреждением гм,141
и соавт отметили что,141
однако следует помнить что,141
при этом как правило,141
у пациентов данной категории,141
в рандомизированном исследовании фазы,141
широких пределах от до,140
свою очередь влияет на,140
у здоровых людей и,140
одной из этих работ,140
некоторые авторы отмечают что,140
как было указано выше,140
общего уровня цен в,140
как правило ассоциируется с,140
надзору за качеством пищевых,140
колеблется от до и,140
л ме ии гл,140
у больных перенесших им,140
ии гл ммоль л,140
одной из наиболее важных,140
то заполняем ячейки единицами,140
по крайней мере отчасти,140
е годы прошлого столетия,140
как независимый фактор риска,140
денежные средства краткосрочные финансовые,140
хотя бы потому что,140
сыворотке крови побочные эффекты,140
по сравнению со всеми,139
у детей школьного возраста,139
целью настоящей работы явилось,139
первой половине х годов,139
западной части берингова моря,139
создание новых рабочих мест,139
ф нансового потенц алу,139
генно инженерными биологическими препаратами,139
колеблется от до а,139
в более поздний период,139
в качестве дополнения к,139
в данной работе мы,139
как показано на рисунке,139
в более ранние сроки,139
в течение периода наблюдения,139
и соавт больных ра,139
не во всех случаях,139
с множественной лекарственной устойчивостью,139
впервые была описана в,139
на их долю приходится,139
у больных хобл с,139
в некоторых из них,139
из рисунка видно что,138
примечание р достоверность различий,138
синдрома системной воспалительной реакции,138
которые могут повлиять на,138
высокой плотности хс лпвп,138
сходные результаты были получены,138
заместительной почечной терапии зпт,138
при этом важно отметить,138
не только у больных,138
нарушения толерантности к глюкозе,138
в зависимости от способа,138
к площади поверхности тела,138
по изучению эффективности и,138
на длине волны мкм,138
к факторам риска развития,138
к середине х годов,138
у лиц старшего возраста,138
по следующей формуле где,138
с врожденными пороками сердца,138
толщины стенки левого желудочка,137
постановление правительства российской федерации,137
по результатам мета анализа,137
является необходимым условием для,137
в широкой клинической практике,137
зависят не только от,137
г были опубликованы результаты,137
также отметить что в,137
одной из самых распространенных,137
охс ммоль л хс,137
вестник калмыцкого института гуманитарных,137
н профессор зав кафедрой,137
похожие результаты были получены,137
речь идет не только,137
фракцию выброса левого желудочка,136
ингибиторов ангиотензин превращающего фермента,136
авторы сделали вывод о,136
за счет средств федерального,136
при этом необходимо учитывать,136
другом исследовании было показано,136
в пределах мм рт,136
с группой контроля р,136
центральной нервной системы и,136
могут быть представлены в,136
внедрения управления по результатам,136
и нижних дыхательных путей,136
можно найти например в,136
в европейском регионе воз,136
пределах мм рт ст,136
в исследование включено пациентов,136
и на тыс населения,136
сердечно сосудистой смертности на,136
и играют важную роль,136
по данным росстата в,136
в условиях рыночной экономики,136
в течение года наблюдения,136
среди которых можно выделить,136
одной из главных задач,136
у пациентов со сниженной,136
рак молочной железы рмж,136
цель исследования изучить влияние,136
выше чем у женщин,136
может свидетельствовать о том,136
из группы высокого риска,135
не могут быть использованы,135
у подавляющего большинства больных,135
др к сожа нанопроволоки,135
в течение определенного времени,135
для оценки качества жизни,135
с помощью компьютерной программы,135
дозе мг раз в,135
течение всего периода наблюдения,135
и хронической сердечной недостаточности,135
поражения сердечно сосудистой системы,135
средний возраст года с,135
дозе мг кг и,135
на рынке труда в,135
артериальная гипертензия аг и,135
в виде монотерапии или,135
на фоне терапии тцз,135
может привести к повреждению,135
авторы пришли к заключению,135
множественной лекарственной устойчивостью возбудителя,135
позволяют надежно получать микро,135
до конца не ясен,135
одна из основных причин,135
эти данные были подтверждены,135
по данным других исследователей,134
ммоль л у женщин,134
клинические исследования показали что,134
мг дл мг дл,134
интима медиа сонных артерий,134
каждые мм рт ст,134
х гг прошлого века,134
объем форсированного выдоха за,134
во многом это связано,134
у больных острым коронарным,134
что приводит к активации,134
в группе комбинированной терапии,134
в течение первой недели,134
где было показано что,134
без нарушений углеводного обмена,134
за определенный период времени,134
не следует забывать что,134
тем не менее и,134
в г сообщили о,134
было показано что использование,134
в проведенных ранее исследованиях,134
твердой структуры стенок каталитического,133
может играть важную роль,133
без учета безвозмездных поступлений,133
товаров услуг рабочей силы,133
времени прогрева твердой структуры,133
одни авторы считают что,133
в рамках этого подхода,133
идея о том что,133
в середине прошлого века,133
в первые месяцы жизни,133
постановлением правительства рф от,133
имт кг м и,133
инфаркта миокарда им и,133
в настоя щее время,133
рекомендации европейского общества кардиологов,133
органов желудочно кишечного тракта,133
настоящее время существует несколько,133
целью настоящего исследования явилась,132
индекс массы миокарда лж,132
восточной части берингова моря,132
покой проба покой проба,132
кроме того некоторые авторы,132
см например см например,132
задней стенки левого желудочка,132
у пациентов во время,132
при этом следует учитывать,132
одной из приоритетных задач,132
автор приходит к выводу,132
показатель фаотведение примечание выделены,132
до настоящего времени остается,132
и сердечно сосудистыми заболеваниями,132
что по видимому связано,132
создает благоприятные условия для,132
на рынке образовательных услуг,132
нашли широкое применение в,132
в течение первых недель,132
и то же время,132
хирургического лечения больных с,132
на перевозку груза камаз,132
активность симпатической нервной системы,131
существует мнение о том,131
которые могут приводить к,131
при этом риск развития,131
лпвп ммоль л хс,131
и соавт сообщают что,131
а также на основе,131
организации экономического сотрудничества и,131
фгбну ниир им в,131
качеством пищевых продуктов и,131
и улучшить качество жизни,131
которых было показано что,131
особенно у пожилых пациентов,131
играет центральную роль в,131
в течение нескольких минут,131
с использованием программного обеспечения,131
раза чаще чем в,131
чаще встречается у женщин,131
частота цитирования ук пифа,130
следует подчеркнуть что в,130
во многом связана с,130
снижены по сравнению с,130
в данной статье рассматривается,130
на выше чем у,130
аналогичные результаты получены в,130
в шейном отделе позвоночника,130
у половины из них,130
в течение мес наблюдения,130
статистическую обработку результатов проводили,130
за сут мес после,130
по крайней мере для,130
в отдаленном периоде наблюдения,130
были получены следующие результаты,130
сут мес после операции,130
на длинном плече хромосомы,130
том числе на фоне,130
индексные пифы фонды облигаций,130
оборотные активы краткосрочные обязательства,130
другие авторы считают что,130
одним из наиболее значимых,130
можно выделить три основных,130
по сравнению со стандартным,130
свою очередь зависит от,130
острый коронарный синдром окс,130
мл кг массы тела,130
до см водн ст,129
в бухгалтерського обл ку,129
в общей популяции населения,129
на самых ранних стадиях,129
также было установлено что,129
что значительно выше чем,129
на региональном уровне в,129
по каким либо причинам,129
раза выше чем у,129
и диастолической функции лж,129
котором было показано что,129
целью данной статьи является,129
н грраспределенная нагрузка отгруза,129
транспортируемого груза н грраспределенная,129
тбк активных продуктов набором,129
без учета винтовой части,129
среди лиц молодого возраста,129
прсила прижатия прижимного устройства,129
у пациентов после трансплантации,129
нед нед нед нед,129
эссе рф эпидемиология сердечно,129
инфекции верхних дыхательных путей,129
рис унок зависимость общих,128
ммоль л у мужчин,128
по шкале впх п,128
диастолической функции левого желудочка,128
где порядковый номер атс,128
а также тот факт,128
со стороны центральной нервной,128
ритма сердца артериальное давление,128
острой массивной кровопотерей крайне,128
по отношению к другим,128
тем не менее они,128
даже несмотря на то,128
и подопытных групп животных,128
в период ранней юности,128
пишет о том что,128
того или иного метода,128
социально экономического развития страны,128
в см вод ст,128
что является одной из,128
с высокой добавленной стоимостью,128
у больных пожилого и,128
исходит из того что,128
и магнитно резонансной томографии,128
лп а мг дл,128
кровопотерей крайне тяжелой степени,128
фв лж фракция выброса,128
настоящее время все большее,128
сердечно лодыжечный сосудистый индекс,128
за переписку поступила принята,128
в виде монотерапии так,128
верхних отделов желудочно кишечного,127
рабочего режима квт действительная,127
центральной нервной системы в,127
интересен тот факт что,127
до см вод ст,127
с технической точки зрения,127
выбор того или иного,127
в зависимости от размера,127
который может быть использован,127
и развития финансового сектора,127
эти данные указывают на,127
исследовании было обнаружено что,127
на центральную нервную систему,127
заключение таким образом в,127
в эксперименте было показано,127
конце х гг в,127
к которым можно отнести,127
п ст гк рф,127
с целью профилактики и,127
независимо от возраста и,127
аутосомно доминантным типом наследования,127
несмотря на значительный прогресс,127
фактором риска сердечно сосудистых,127
туберкулез внутригрудных лимфатических узлов,127
через мин после начала,127
ствола левой коронарной артерии,127
во время физической нагрузки,127
где потребная мощность двигателя,127
хс лвп ммоль л,127
одной из причин этого,126
комбинированная терапия мт и,126
уровень синхронизации бизнес циклов,126
с другой стороны это,126
в остром периоде заболевания,126
было выдвинуто предположение что,126
играют ведущую роль в,126
оказывают негативное влияние на,126
больные были разделены на,126
и методы обследовано больных,126
в расчете на душу,126
менее мл мин м,126
в течение как минимум,126
что приводит к образованию,126
в условиях общей анестезии,126
с использованием пакета программ,126
или мм рт ст,126
многочисленные исследования показали что,126
том числе у детей,126
инфляции экономическая интеграция высокий,126
финансового сектора низкая волатильность,126
интеграция высокий уровень синхронизации,126
факторов производства схожие уровни,126
бизнес циклов высокая степень,126
низкая волатильность реальных обменных,126
выделить следующие высокая мобильность,126
овз можно выделить следующие,126
соглашение об избежании двойного,126
аэрозольной терапии во время,126
при правительстве российской федерации,126
селективные ингибиторы обратного захвата,126
является важным фактором риска,126
высокая мобильность факторов производства,126
антителам к циклическому цитруллинированному,126
высокая степень интеграции финансовых,126
основных критериев овз можно,126
схожие уровни инфляции экономическая,126
занимает второе место в,125
может играть роль в,125
кемеровского государственного университета т,125
на п дпри мств,125
