text,freq
лет человек контрольной группы,170
исследования показали что в,170
с успешным чрескожным вмешательством,170
после перенесенного ии пациентов,170
двойном слепом плацебо контролируемом,169
скф скорость клубочковой фильтрации,169
в раз меньше чем,169
у пожилых больных с,169
в отношении риска развития,169
сведения о том что,169
во время операции и,169
то же время у,169
была выше чем в,169
однако стоит отметить что,169
с тяжелой сочетанной травмой,169
представляет собой одну из,169
данные свидетельствующие о том,169
гипертрофии миокарда левого желудочка,168
хронической почечной недостаточности хпн,168
ссз сердечно сосудистые заболевания,168
с высокой степенью достоверности,168
в ряде экспериментальных работ,168
в этой возрастной группе,168
должны быть направлены на,168
г кг массы тела,168
в одной из своих,168
у пациентов моложе лет,167
при этом установлено что,167
было высказано предположение о,167
занимает одно из ведущих,167
артериальная гипертензия сахарный диабет,167
нарушением толерантности к глюкозе,167
белок связывающий жирные кислоты,167
у пациентов на фоне,167
фактор некроза опухоли альфа,167
следует отметить что при,167
в различных странах мира,167
патологии сердечно сосудистой системы,167
мм рт ст при,167
у больных хсн с,167
клинических исследований свидетельствуют о,166
подобные результаты были получены,166
сердечно сосудистой патологии и,166
на от исходного уровня,166
может быть использовано в,166
в большинстве развитых стран,166
в котором принимали участие,166
избыточная масса тела и,166
необходимо также отметить что,166
речь ид т о,166
м над ур м,166
у пациентов мужского пола,165
ежеквартальный научно практический журнал,165
у пациентов перенесших инсульт,165
известно что одним из,165
статистическую обработку полученных данных,165
через год после кш,165
на протяжении длительного периода,165
помощью пакета прикладных программ,165
по мнению большинства исследователей,165
дозе мг сут и,165
ишемической болезнью сердца и,165
у детей первых лет,165
сердечно сосудистых событий и,165
что на сегодняшний день,165
по этой причине в,165
при наличии у пациента,165
механизмов управления по результатам,165
и может приводить к,165
у подавляющего большинства пациентов,165
по крайней мере на,165
белого вещества головного мозга,164
д яльност п дпри,164
была достоверно ниже чем,164
гипертрофия миокарда левого желудочка,164
через мес после операции,164
и улучшение качества жизни,164
в ранние утренние часы,164
со смешанным фенотипом хобл,164
в г опубликованы результаты,164
хотя бы одного из,164
это позволяет предположить что,164
это было подтверждено в,164
примечание выделены достоверные различия,164
было установлено что при,164
с данными других исследователей,164
в рамках данной статьи,163
тем не менее не,163
е сут после операции,163
что особенно важно для,163
в начальный момент времени,163
в составе комбинированной терапии,163
может приводить к возникновению,163
течение длительного периода времени,163
т ч рпроизводительность т,163
достоверность различий по сравнению,163
множественной лекарственной устойчивостью млу,163
одним из важнейших факторов,163
вплоть до настоящего времени,163
двустороннего критерия фишера критерия,163
показали что у пациентов,163
за последние десять лет,163
к белкам коровьего молока,162
российской федерации до года,162
для оценки риска развития,162
в нашем случае это,162
печатный е на н,162
вне зависимости от наличия,162
в высших учебных заведениях,162
составлено авторами на основе,162
в остром периоде инсульта,162
и внезапной сердечной смерти,162
внезапной сердечной смерти всс,162
процентного канала тм дкп,162
сердечно сосудистых факторов риска,162
рассматривается как одна из,162
через ч после операции,162
настоящее время большое внимание,162
у больных сердечной недостаточностью,162
иссечение сумки латеральныйкраевая резекция,162
по данным исследования эссе,162
последние годы большое внимание,162
со сниженной фракцией выброса,161
у больных пожилого возраста,161
у мужчин у женщин,161
двухшаговый метод наименьших квадратов,161
индексом массы тела имт,161
эпидемиология сердечно сосудистых заболеваний,161
все это свидетельствует о,161
вносят существенный вклад в,161
и за ее пределами,161
в рамках настоящего исследования,161
на первый план выходят,161
что может указывать на,161
субъектов российской федерации и,161
в развитых странах мира,161
с артериальной гипертонией аг,161
по данным многих авторов,160
структура левого желудочка функциональный,160
следует принимать во внимание,160
с р р р,160
наностержни нанодиски нанопроволоки и,160
за период гг в,160
таблица основные лабораторные и,160
с той или иной,160
вариабельность гликемии ммоль л,160
данном случае речь идет,160
имеющиеся данные свидетельствуют о,160
к их числу относятся,159
в раз ниже чем,159
и качество жизни пациентов,159
микро рнк микро рнк,159
мм рт ст среднее,159
постановлением правительства российской федерации,158
проксимального отдела плечевой кости,158
в многочисленных клинических исследованиях,158
что свидетельствует о том,158
на момент установления диагноза,158
и что особенно важно,158
может быть связано как,158
сводится к тому что,158
в самом общем виде,158
нами было показано что,158
что на наш взгляд,158
вероятно это связано с,158
было показано что применение,158
осложнений со стороны жкт,158
к циклическому цитруллинированному пептиду,158
гипоталамо гипофизарно надпочечниковой системы,158
у людей старше лет,157
работах было показано что,157
и периферической нервной системы,157
за весь период наблюдения,157
частности было показано что,157
по сравне нию с,157
в качестве зависимой переменной,157
в было показано что,157
из табл видно что,157
представления о том что,157
пришла к выводу что,157
образование производит отрицательный единовременн,156
п кумароил рамнопиранозид кемпферол,156
мочу под наблюдением доля,156
результат теория несовершенств а,156
авторы выборка тип исследуемы,156
квадратов принимается экономия социальнополитическая,156
наименьших квадратов отклоняется стран,156
инвесторов затрудняет реформы законодательств,156
квадратов й период отклоняется,156
при ревматоидном артрите ра,156
полностью удерживающих мочу баллы,156
эндогенная фискальная политика избиратели,156
страна соотношение доходов самых,156
образование доходам метод наименьших,156
страна доходы населения составляющи,156
одним из наиболее частых,156
во время общей анестезии,156
метод наименьших квадратов й,156
принимается политическая страна соотношение,156
метод наименьших квадратов неоднозначны,156
оценка значимости тестируемого механизма,156
долгосрочный период образование производит,156
уравнительную политику противоречащую интересам,156
квантиль метод наименьших квадратов,156
квантили метод наименьших квадратов,156
отрицательный единовременн ый эффект,156
экономический рост каналы механизм,156
рождаемость страны доходы населения,156
подробнее об этом см,156
таблица основные теоретические модели,156
что снижает стимулы для,156
данных о неравенств е,156
в коре головного мозга,156
в тот же период,156
в отношении снижения риска,156
мочу баллы количество прокладок,156
политика избиратели голосуют за,156
международной классификации болезней го,156
нестабильность социальнополитическая нестабильность создает,156
острого инфаркта миокарда оим,156
во й линии терапии,156
для инвестиций страны доходы,156
рост но его лагированный,156
составляет на тыс населения,156
с нормальной функцией почек,156
число пациентов не удерживающих,156
квадратов принимается стран к,156
в е годы века,156
двухшаг метод наименьших квадратов,156
квадратов отклоняется неравенство снижает,156
наименьших квадратов принимается политическая,156
квадратов принимается продолжение таблицы,156
по шкале впх сп,156
не удерживающих мочу под,156
по трехшаговый принимается краткосрочны,156
среди мужчин среди женщин,156
период отклоняется долгосрочный период,156
каналы механизм авторы выборка,156
наименьших квадратов двухшаг метод,156
тестируемого механизма страна доходы,156
голосуют за уравнительную политику,156
его лагированный эффект положительны,156
отклоняется стран доходы населения,156
к богатейших метод наименьших,156
риски для инвесторов затрудняет,156
для того чтобы получить,156
наименьших квадратов двухшаговый метод,156
накоплению человеческого капитала бедные,156
неравенство снижает рождаемость страны,156
сыворотке крови у больных,156
политическая экономия эндогенная фискальная,156
экономия социальнополитическая нестабильность социальнополитическая,156
что свидетельствует о наличии,156
бизнеса что снижает стимулы,156
того или иного вида,156
на более поздних стадиях,156
х данных показатель неравенства,156
т джини по доходам,156
с реактивного белка в,156
имеет важное значение в,156
данных показатель неравенства источник,156
заболевания сердечно сосудистой системы,156
источник данных о неравенств,156
направленные на защиту прав,156
северной части охотского моря,156
населения составляющи е четвертый,156
е четвертый квантиль метод,156
внешней торговли добавленной стоимостью,156
несовершенств а кредитного рынка,156
принимается краткосрочны могут позволить,156
кредитного рынка неравенство препятствует,156
теоретические модели влияния неравенства,156
неравенство препятствует накоплению человеческого,156
левого желудочка фв лж,156
продолжение таблицы политическая экономия,156
коэффициент джини по трехшаговый,156
квантили двухшаг метод наименьших,156
створки митрального клапана см,155
вегетативной нервной системы внс,155
параметрыконтрольная группа больные вцп,155
кольцо задней створки мк,155
кольцо передней створки митрального,155
легочной гипертензии медиана й,155
около млн лет назад,155
у больных ранним ра,155
наличия умеренной легочной гипертензии,155
снижались средние значения максимальной,155
кольцо трикуспидального клапана см,155
левой ножки пучка гиса,155
медиальный сегмент мжп см,155
клапанов базальных сегментах боковой,155
данные спектральной тканевой допплерометрии,155
я группа кольцо задней,155
фиброзном кольце задней створки,155
базальный сегмент мжп см,155
тканевой допплерометрии у больных,155
сегментах боковой стенки лж,155
й перцентили параметрыконтрольная группа,155
независимым фактором риска развития,155
р боковой стенки лж,155
могут быть разделены на,155
тем не менее при,155
то же время использование,155
передней створки митрального и,155
в работах посвященных изучению,155
у впервые выявленных больных,155
и передней створки митрального,155
боковой стенки пж см,155
боковой стенки лж см,155
контролем на фиброзном кольце,155
в течение мин после,155
сд го типа в,155
у больных вцп в,155
с мм рт ст,155
и медиальных сегментах таблица,155
в свою очередь вызывает,155
на первый план выходит,155
ответ на этот вопрос,154
с низким уровнем образования,154
заключение следует отметить что,154
в регионарные лимфатические узлы,154
полученные результаты указывают на,154
той или иной страны,154
в разных регионах мира,154
мг кг сут в,154
наши данные согласуются с,154
тем или иным причинам,154
м грраспределенная нагрузка отгруза,154
рпки мес пл мт,154
рпроизводительность т ч рпроизводительность,154
первой половине х гг,154
ленты м ширина ленты,154
по данным одних авторов,154
соглашения о распределении затрат,154
приводной подвеске со стороны,154
ч рпроизводительность т ч,154
сентябрь н д февраль,154
у больных сд го,154
приложенное к приводной подвеске,154
годы великой отечественной войны,154
у пациентов основной группы,154
по данным магнитно резонансной,154
д февраль н д,154
выводу о том что,153
и очень высокого риска,153
на ранней стадии заболевания,153
стоит обратить внимание на,153
в значительной степени определяет,153
артериального давления ад и,153
с использованием критерия стьюдента,153
причинно следственной связи между,153
различия считали статистически значимыми,153
ммоль л тг ммоль,153
мм рт ст дад,152
сопротивление поступательному перемещению перед,152
острым нарушением мозгового кровообращения,152
перемещению перед отвалом призмы,152
факторов риска сердечно сосудистых,152
тяжесть состояния при поступлении,152
отвалом призмы волочения грунта,152
последних лет свидетельствуют о,152
х гг прошлого столетия,152
к тамоксифену ткань уровень,152
с этим представляет интерес,152
могут быть использованы как,152
мкг кг мин в,152
и юго восточной азии,152
лет до н э,152
том или ином виде,152
не может рассматриваться как,152
по состоянию на год,152
экскреции альбумина с мочой,152
в первые часы после,152
говорить о том что,152
при выписке из стационара,151
относится к числу наиболее,151
одним из важных факторов,151
кроме того у больных,151
во время искусственного кровообращения,151
настоящее время одним из,151
систолической дисфункции левого желудочка,151
острый инфаркт миокарда оим,151
стентов с лекарственным покрытием,151
в различных регионах россии,151
в х годах века,151
с результатами других авторов,151
ишемической болезни сердца в,151
том числе из за,151
в рандомизированных клинических исследованиях,151
в литературе описаны случаи,151
социально образовательная мысль м,151
фонды облигаций денежного рынка,150
высокой плотности хс лвп,150
значительной мере зависит от,150
одной из важнейших проблем,150
принадлежность ук той или,150
несмотря на тот факт,150
целью нашего исследования явилось,150
свободных жирных кислот сжк,150
хронической болезнью почек хбп,150
функции внешнего дыхания фвд,150
российской федерации а также,150
в заключение следует отметить,150
в г был опубликован,150
по ведению больных с,150
что находит отражение в,150
для того чтобы определить,150
в общей численности населения,150
счет эд соэ мм,150
системная красная волчанка скв,149
площадь поверхности сцепления сваи,149
мг дл мкмоль л,149
дад диастолическое артериальное давление,149
побочные эффекты со стороны,149
в первой половине века,149
в течение последнего года,149
при решении уравнения для,149
с нарушением функции почек,149
то же время с,149
у больных сд в,149
смерти от всех причин,149
и соавт опубликовали результаты,149
и соавт при обследовании,149
зависимости от степени тяжести,149
у детей дошкольного возраста,149
ни один из них,149
большое внимание уделяется изучению,149
сердечно сосудистого риска сср,148
при наличии факторов риска,148
сдла мм рт ст,148
основных факторов риска развития,148
до конца не ясны,148
клиренс креатинина мл мин,148
в начале хх века,148
в более позднем исследовании,148
верхних дыхательных путей и,148
уровня с реактивного белка,148
рака молочной железы и,148
при хронической сердечной недостаточности,148
перекисного окисления липидов и,148
в европейской части россии,148
желудочно кишечного тракта в,148
у больных получающих лечение,148
не только у пациентов,147
все больше внимания уделяется,147
далеко не во всех,147
после эндопротезирования тазобедренного сустава,147
в течение первых нед,147
является одной из наиболее,147
и денежно кредитной политики,147
странах западной европы и,147
с высоким уровнем доходов,147
